,Date,Score,reviews
744,2018年11月28日,1,廣告多到滿出來，有錢一直打廣告麻煩把這些錢回饋給你們所剩不多的玩家，每次一出遊戲就要出廣告洗，除了反胃我沒看出別的
745,2018年11月28日,3,廣告做太浮誇了還結合PUBG但事實上遊戲裡根本沒有這系統G妹太多這種的浮誇廣告了(我覺得你們可以去做別種類型的遊戲不然會很乏味)
746,2018年11月29日,5,我下載安裝之後就一直閃退沒辦法創件人物 我手機 HTC 10 PRO 怎麼會這樣看廣告好像蠻好玩的 所以才下載來玩沒想到不能玩還一直閃退
747,2018年11月29日,5,預科怒他
748,2018年11月25日,3,這類型遊戲還蠻喜歡 還沒正式玩所以先給3顆 好玩在多給囉 希望別讓我失望
749,2018年11月25日,1,安裝完就一直卡在下載資料 不然就是角色登錄後就直接閃退 連玩的機會都沒有 煩請官方馬上處理
750,2018年11月26日,1,一定要開麥克風才能繼續遊戲，可以為像我這種不喜歡用自己的聲音去認識別人的人著想一下
751,2018年11月27日,1,廣告app
752,2018年11月24日,1,一直斷線
753,2018年11月24日,1,進不去
754,2018年11月23日,5,畫面順暢~~~~
755,2018年11月22日,3,進不去
756,2018年11月24日,3,為什麼不能登錄遊戲？
757,2018年11月23日,1,課長遊戲要課才能打不然旁邊吃屎 怪可以穿牆打人沒有走位可言 我 ...唯一優點地圖不錯 劇情一般
758,2018年11月22日,5,讚好玩
759,2018年11月22日,1,垃圾
760,2018年12月27日,1,幾天沒用就要更新，更新完又不成功，幹他粿的勒是要更新多久
761,2018年12月21日,5,玩了兩個禮拜多 很好玩 可是他說我裝置不可用 進不去登入 我玩了兩個禮拜了說 note8 希望可以解決
762,2018年12月17日,1,廣告夠多，跟拳皇一樣煩人，特別下載來給評價順便幫你們衝下載次數，貼心吧。
763,2018年12月13日,1,很有耐心的擾人廣告，我也很有耐心的給一星
764,2018年12月8日,5,我覺得很好玩因為他跟傳說和第五一樣可以組隊尤其是還可以打粽子
765,2018年11月29日,4,活動時間 都晚上比較多 上晚班的不用玩了 QQ
766,2018年11月29日,1,note8下載完登入卡黑畫面無法玩很可惜
767,2018年12月6日,1,G妹怎麼還有臉在業界打混啊？抄襲抄成那樣，遊戲模式又是典型的「戰力」「VIP」「抽獎」，太毒瘤了吧
768,2018年11月28日,1,OMG OMG OMG，雞妹又有新遊戲，快來玩看看，如果不用儲值，我再給5星
769,2018年12月4日,1,剛安裝完就立馬閃退，實在太可惜了，我非常期待這個遊戲說
770,2018年12月4日,1,按背包，完全沒有東西顯示出來。組隊，看不到隊員也不能退出。已經試很多次重登很多次了
771,2018年12月3日,1,看個youtube廣告一直跑出來 還都超過5秒不能跳過是怎樣==
772,2018年12月2日,1,麻煩請再youtub的廣告少點可以嗎？每次看影片都會先跳出來，看到一半也會跳，完全影響看影片的心情了，可以相關人員處理嗎
773,2018年11月29日,1,下載完進去就變黑沒畫面 還下載2次一樣 爛
774,2018年12月1日,1,非常不人性，換到另一支手機玩，結果一直找不到角色在那個伺服器，別的遊戲大多都會顯示，為何這點沒做到。
775,2018年11月29日,1,特地點一秒下載給負評，x媽的廣告多的三小
776,2018年11月29日,1,凡是G妹就是騙人廣告加正妹遊戲爛就是爛，如果G妹代理黑色沙漠我也是同樣的評論，絕對抗拒G妹旗下任何遊戲
777,2018年12月1日,1,垃圾代理商，剛下載好，馬上刪除遊戲，請不要回應我，你們只會打官腔，不會重視玩家的需求，不要再欺騙了，想賺錢也拿點誠意出來，已經被你們欺騙多年。
778,2018年11月25日,5,說真的 這才是我理想的手遊，像online但又輕鬆
779,2018年12月1日,2,遊戲劇情不錯，角色及場景畫風更是不在話下，但是人物職業模糊，拳手/劍客近戰就算了，連槍手也是進戰職業!? 連閃招都要冷卻超久?
780,2018年12月1日,1,G妹遊戲的廣告果然沒讓我失望過 笑死
781,2018年11月26日,3,很玩的遊戲，但願不要像老九門一樣，只瘋一陣子就沒了。這樣儲值很冤枉。
782,2018年11月27日,1,我玩到一半就卡在副本出不來，結果一直重新登入都進不去，搞甚麼吖
783,2018年11月28日,2,遊戲畫面跟廣告差很多，操作也完全不同，假如是像廣告那種全3D冒險遊戲那還有一些興趣。
784,2018年11月26日,3,副本會卡住回溯，其他就很精細用心，不過後期還是需要小克金
785,2018年11月28日,1,廣告很煩 實際上假裝安裝是為了給一星，所以不用再打廣告了，因為爛泥扶不上牆，而且給人造成困擾！ 謝謝
786,2018年11月24日,1,儲值後沒拿到鑽石，公司也不處理，申請退款就直接鎖帳號，這種爛公司不要玩也好
787,2018年11月25日,2,"手機A9s 下載完該遊戲即打不開且不斷自動閃退,手機正常且重開機依舊,無法理解"
788,2018年11月24日,1,電腦手機安裝完登入都閃退或黑屏，連一顆星都不給的
789,2018年11月23日,1,我下載只是為了評一星 真的很爛 VIP炒短線 看到的可以推我上去 旁邊按讚→→
790,2018年11月23日,1,下載後 進入遊戲 完全無法按確定，史上第一次我下載後馬上刪除的遊戲。
791,2018年11月23日,1,更新後 網路一不給力 就一直重啟 爛遊戲無誤
792,2018年11月25日,5,看到廣告，覺得應該不錯，而且以前有看過盜墓的小說，這遊戲動畫做的還滿精緻的。有心。
793,2018年11月23日,1,Youtube廣告太多又強制看，載後資源包更新又太大不想玩，直接給低分。
794,2018年11月23日,1,上次狂洗一個垃圾大夢廣告這次又洗另一個垃圾 煩不煩啊
795,2018年11月25日,5,操作滿簡單的，喜歡這種華麗的技能 希望可以持續推出新技能
796,2018年11月23日,1,他媽遊戲把錢都拿去買廣告，不好好改良遊戲品質，U2上滿滿都是你們廣告，遊戲品質卻是欺騙大眾，千萬別下載，不然會後悔。
797,2018年11月28日,1,搞個優化不會給點畫面或提示嗎，弄得好像當機一樣，直接刪檔不玩了。
798,2018年11月24日,1,可以不要讓我在Youtube看到這個廣告了嗎很煩懂嗎糞遊戲
799,2018年11月24日,1,第一個全給一星的遊戲，一星給盜墓題材一個面子，不然就這逼樣估計一堆人給負一星吧？ 指引任務，一個引導的東西過副本進不去，最基本的最開始的東西，基本的東西都弄不好怎麼敢直接開測，擺明了遊戲問題，都不用測試在上架嗎？江湖大夢賺爽了又要擺爛了就對了？
