,Date,Score,reviews
516,2017年3月29日,5,現在評價五星還有獎勵嗎。 遊戲流暢容易摸索，也不用花大把時間練功升等。卻又不失趣味及挑戰。真的還不錯玩。
517,2017年4月15日,5,雖然人多容易小卡 可是很快就修補 也會補償 不用太費心也可以玩 不錯！
518,2017年4月5日,5,不錯遊戲，送賺石也很阿沙力，不用時常盯著手機打怪，就會自動幫我們升級及打裝備，非常適合上班族遊戲
519,2017年3月4日,5,24h自動練功 簡單 容易上手的遊戲 每天只要撥一點點時間 上去清清背包再解個任務就能夠輕鬆升級了 好玩(￣∇￣)
520,2017年2月19日,5,工作忙碌也能享受遊戲的樂趣 肽棒了 立馬升V8
521,2017年3月23日,1,上網做了點功課發現前身是大天使掛機，不敢玩了，等過一兩個月就惡性關閉伺服器了吧
522,2017年3月19日,5,不用花費很多時間培養 簡單易上手 願意儲值的好遊戲 活動也都很有趣😄😄 大家快來玩玩   歡迎大家一起討論
523,2017年3月29日,5,蠻耐玩的一款遊戲 不用整天盯著也可以打怪升級 非常適合 有點懶又愛玩的玩家們 !
524,2017年4月14日,5,一款不錯的遊戲 不用一直盯著螢幕 也不用怕說關閉遊戲後等級追不上  可以不用在浪費時間找新遊戲玩了
525,2017年3月29日,5,非常棒 可以不用一直擔心不會落差別人太多上線動動頭腦跟手指不用趕的感覺真的很好
526,2017年3月9日,4,不得不說 這遊戲的小編服務非常好 因為帳號綁定問題 親自回mail給我 五顆星小編！！ 事件結束會改回五星：）
527,2017年3月10日,5,非常容易上手的遊戲，不用一直盯著螢幕看，又可離線掛網，非常適合上班族。內容也很充實，很耐玩！害我一玩就停不下來~
528,2017年2月26日,5,很輕鬆自在的遊戲 希望推出更多活動 爽感滿分 感謝小編的辛苦 讓遊戲品質保持下去
529,2017年3月31日,5,為什麼我裝備欄數增加到200了，打到的裝備根本沒超過數量就通知我裝備欄滿了，然後就再也打不到裝備了，增加只有打造、掃蕩、飛速才會再額外增加裝備數量，請改善
530,2017年4月25日,5,易上手，不錯玩。在上班休息時間有時間可以滑一下，不用整天盯著，也不用擔心沒錢煉裝😂這是我玩最久這種款式的手遊了。
531,2017年3月29日,5,此款遊戲真的很輕鬆方便、不用24小時盯著、能自動打怪升級掉裝備、而且連平常沒在玩什麼手遊都覺得操作簡單又好玩、辛苦遊戲工程以及克服👍
532,2017年4月5日,5,果真是個經典的好遊戲，無須時刻盯著手機，掛機練功不怕跟不上別人的等級，不課金一樣玩得很開心。
533,2017年3月26日,5,手遊新的突破，畫質不輸韓式畫風，遊戲流暢度媲美大廠出品，是２０１７最強勢的代表之作
534,2017年4月8日,5,系統不會過於複雜，遊戲輕鬆好入手，自動掛機，隔段時間再登入，又升好幾登，以及滿滿的背包可鎔練，對於遊戲時間短的人再適合不過了
535,2017年5月2日,5,這款遊戲好玩又不會浪費上班族時間，鑽石送的也很豪氣離線還是會自動練功下班玩也不無聊，好遊戲要推……推推！
536,2017年2月13日,5,整體玩法不錯 少了很多練功機會 鑽石其實也很多管道可以賺 非課金玩家還是可以玩玩
537,2017年3月12日,5,簡單輕鬆就能入手的無盡戰記 值得推薦給大家一起來玩 活動多 鑽石又很敢大放送 ～
538,2017年4月24日,5,玩過那麼多遊戲就屬這款不用顧著，原本以為退出遊戲就下線了，沒想到幾天沒玩又上線，等級竟爆衝，還一堆綁鑽，害我又迷上這遊戲了，總之是款不錯的遊戲，試玩了一個多月，還是儲值了，good game!
539,2017年3月28日,5,很棒的遊戲很適合上班族，不必整天顧著，也能有裝備等級，讚！ 更重要的是小編發鑽石就是不手軟啦！
540,2017年2月21日,5,蠻好玩的遊戲，連離開也可以繼續練等級，真是不錯。如果可以的話應該在新手教學跟遊戲攻略和功能上多做說明，這樣的話（小編）應該就蠻多星星了。
541,2017年3月17日,5,想不到第一次玩掛機遊戲就上手，不用時時刻刻上線，可以多點時間陪陪家人，實在是大推的遊戲
542,2017年3月4日,5,不錯，雖然畫面比較簡單，但遊戲不用費太多時間，自動掛機這點很好，唯一要改善的是vip的差別，要不然沒花大錢的玩家很難跟其他高vip的玩家戰鬥，希望可以修正一下平衡。
543,2017年3月11日,1,毫無意義的遊戲，完全不能手動打怪，看著角色自己打怪，弓箭站著讓怪打，不能打帶跑好像笨蛋一樣，就是看誰錢砸的多就強的遊戲，無言，要玩請三思
544,2017年4月8日,5,目前玩到現在第一次有所評論的！真的送鑽不手軟！不管斷線或閃斷都有補償，再來就是不用一直開這離線也會自動練功，真心推薦！
545,2017年2月18日,5,對於空閒時間不一定的玩家來說，真的很方便，時間不會被綁死，也不用邊跟家人朋友吃飯，邊按手機。不在線上也能打怪，手機不必長時間掛著耗電。
546,2017年5月5日,5,無盡戰記，是一個很棒的遊戲，讓人一玩就上癮 ，簡單又好玩 而且不用花太多錢 ，個人非常的喜歡也推薦大家一起來玩。
547,2017年4月6日,5,這個遊戲真的很適合上班族及有小小孩的玩家們，可以自動掛等，還能有時間陪小孩，真是太棒了
548,2017年3月5日,5,省時好玩，可惜我兩支手機用同帳號登入的卻無法同資料又變成新創
549,2017年3月15日,5,非常不錯的一款遊戲，不用一直盯著手機看。也不用24小時都在擔心煩惱掛機會不會被殺。這裡都做到了。對一個上班族來說。真解力啊。
550,2017年3月5日,5,玩那麼多手游 終於找到符合我的遊戲了 簡單明瞭 不需動太多腦 好遊戲 支持
551,2017年4月3日,1,還是要放棄了，騎士等級贏2級，戰力多十萬還是打輸弓手，這遊戲還能玩嗎，不如就弓手一種職業，玩其他職業的人都被當傻瓜。
552,2017年4月15日,4,裝備紫色月亮如果能跟著轉移就更棒了!還不錯玩的遊戲!美中不足的還是裝備融鍊重複的一直重複!這遊戲是不用花太多時間一直看手機!!!
553,2017年4月17日,5,很棒的遊戲 不需要課金也可以很強 適合來殺時間用 加油 活動也非常豐富
554,2017年3月21日,5,很不錯玩的遊戲 離線也能持續升級也不用太花錢 挺適合上班族的人來玩
555,2017年3月22日,5,腰受哦，這不是掛機的遊戲嗎？怎麼會讓人一直想要盯著螢幕一直看，好玩好玩，一定要推薦給朋友一起玩，好玩的遊戲背後的團隊大家辛苦了，加油
556,2017年4月7日,5,"不用太專注在遊戲上,就算上班也能自動練功,對忙碌的上班族來說好玩又可以消遣時間,很值得推薦喲！"
557,2017年3月11日,5,不用整天在線上依然可以練功，對上班族來說可是一大福音，推薦給大家一起來玩喔！
558,2017年3月4日,4,好玩不用花太多時間在手機上又能享受玩的樂趣加油哦別太快倒閉~給5顆星哦！
559,2017年3月21日,4,遊戲不錯玩，這遊戲對服務業工作的人是很方便的，只是等級很難升，可以多提供一些好升等的副本喔
560,2017年2月17日,5,實在是非常好玩遊戲內容豐富不花費時間，畫面還真不錯，小編非常大方~
561,2017年2月17日,5,不錯玩 希望可以出經驗加倍卷軸 不然後面升等很慢
562,2017年2月22日,5,好玩不用耗很多時間 處理問題也會有補償 很不錯的遊戲
563,2017年3月10日,5,好遊戲 不用讓人每天都盯著看 想到或有空的時候再上線看一下就好了 棒棒
564,2017年4月9日,5,感謝熱情小編的有問必達，以及熱血開發團隊的創造力，期待你們持續優化及增加遊戲的樂趣唷！！
565,2017年3月27日,5,非常好玩很適合上班族群鑽石送的又大方歡迎大家一起玩，就算是女生也玩的很有趣
566,2017年2月27日,5,遊戲很好玩，綁定跟沒綁定的寶石可以一起用，不過一開始新手爬的很慢需要慢慢玩才能變強
567,2017年5月10日,5,不錯的打發遊戲時間 可以讓上班族偶爾玩玩手遊交朋友
568,2017年2月24日,5,上至工作首選遊戲  畫面復古  但又不失趣味  難度不大  適合各層面人士
569,2017年4月27日,5,這遊戲很好上手，也不需要一直去盯著上線，滿適合上班族打發手時間，重點官方送鑽石很慷慨，開服就送三千鑽，裡面的玩家也都會互相交流玩法，實在是款不錯手遊
570,2017年4月18日,5,還滿耐玩的遊戲  能自動練功讓我偶爾上來看看任務就好很不錯
571,2017年3月3日,5,這遊讓我輕鬆無壓力了許多，偶爾上來手指運動一下就好，比之前的掛機遊只有2個戰鬥視窗彈來彈去得好，這個戰鬥，打怪也比較有人物的真實感，然而也不用花太多時間
572,2017年3月25日,5,感覺還不錯玩~不用花太多時間非常好上手大遊戲鑽石大方送給你
573,2017年3月18日,5,不用顧著遊戲，自動練功打怪，真的很好玩喔！這是我近期最喜歡的一個手遊！大家快下載遊戲，一起聊天組隊打寶喔！
574,2017年4月22日,5,如果活動在多一些會更加吸引玩家，稀有裝備和掉寶率提升的話玩家會陸陸續續下載
575,2017年4月28日,5,第一次玩這類型的手遊，不用花太多時間去練功，很適合上班族打發時間的休閒活動！加油~
576,2017年4月19日,1,小篇恐赫我~說要封鎖我全部的帳號~你他馬的~老子到警察局告死你~誰寫的~給我交代清楚歐~是怎樣不能給你們一星嗎？你沒交代清楚老子到警察局告你毀謗~大家走著瞧~
577,2017年4月27日,5,還不錯，離線還可以練功，不用太多時間花在遊戲上，希望商店刷新鑽石需求能少一點，月卡每日送的鑽石低了一點…
578,2017年2月25日,5,無盡戰記-王者歸來   讚  不怕沒時間玩 離線繼續打怪練等刷裝備   推薦
579,2017年4月11日,5,非常適合玩的一款手遊，不用無時無刻的一直玩，上線只要整理一下背包跟一些任務獎勵，算是款可以輕鬆玩的遊戲
580,2017年5月2日,4,好玩 不用一直開著也能練功 偶爾登入打活動清理包包就好 很方便
581,2017年2月17日,5,遊戲內容豐富，還有24小時自動掛機練功，是款容易上手的經典練功手遊，玩家越多玩起來更起勁。
582,2017年3月30日,5,努力培養了一萬次可是為什麼沒拿到最後一階獎勵？伺服器６５處理好給五星，昨天發生今天解決，小編的處理速度沒話說，給五星。
583,2017年4月1日,5,非常棒的遊戲 鑽石又很肯送 不用特別花時間玩  養成非常有熱趣
584,2017年3月4日,5,不用花太多錢 也可以打贏高v玩家  一款非常平衡的遊戲 獎勵不錯 小編非常熱心
585,2017年3月11日,1,毫無意義的遊戲，完全不能手動打怪，看著角色自己打怪，弓箭站著讓怪打，不能打帶跑好像笨蛋一樣，就是看誰錢砸的多就強的遊戲，無言，要玩請三思
586,2017年3月15日,5,上班族最好的遊戲不浪費時間自動練功很方便，花點小錢也能練的爽爽的，佛心的遊戲
587,2017年3月21日,5,遊戲的風格個人還蠻喜歡的，內建的機制讓一般玩家能夠不用持續性盯著銀幕，能專心做自己的事。而閒暇之餘又不用怕等級、裝備輸朋友太多。值得推薦。
588,2017年3月3日,5,找了很多款的手遊，目前就這款不需一直花時間玩，離線時段也在練功，每天只需要一些時間，很適合時間不多的朋友，能做自己的事，也能夠休閒，很棒。
589,2017年3月9日,5,這是我玩過最讚的練功遊戲! 24小時自動打怪，而且不需要花一堆台幣才可以變強!  之前玩過的大多都要噴一堆台幣...  總之這遊戲真的好讚QQ 感謝所有的人員!
590,2017年4月7日,5,是一款不錯的游戲，但能否請公司幫我查一下腳色名稱（噬魂行者）在哪一個伺服器？因為換手機而忘記伺服器名稱了，現在找都找不到，謝謝
591,2017年2月25日,5,雖然一開始不太會玩，也不清楚怎麼同等戰力會差那麼多…但慢慢摸索以及好心人提醒，慢慢玩出心得。這遊戲值得一直玩下去，不用開著也能升級，太棒了！
592,2017年4月18日,5,超讚的遊戲。 不用一直盯著手機，也能24小時自動練功 免費鑽石也送很大。重點是處理維修速度也很快。小編回復也很快。 很少手遊能如此耐玩的……！
593,2017年4月6日,5,很棒的遊戲時空背景和設計 獎勵給的很大方 是讓人會上癮的一款手遊 讚！
594,2017年2月13日,5,真的還滿好玩的遊戲，對於要上班的我每天只要花20分鐘接任務，就可以自己升等! 但是最近在PK搶奪都會卡住，然後無緣無故就失去一次機會，錢也沒下來，這點希望改進!
595,2017年4月5日,5,透過line下載後還一直玩的遊戲大概只有這個了，鑽石一個狂送猛送阿(大心
596,2017年3月15日,5,遊戲是好玩，希望你出活動多元化D， 工會希望你加多些職位 ，可以比其他玩家提升嘅機會，不要只有 正同副。
597,2017年3月6日,5,該遊戲不錯，比起之前同類型的遊戲有多些玩法，且不用一只盯著螢幕，有更多時間忙其他事，給五顆星！
598,2017年5月1日,5,感覺比其他遊戲好，能真正讓無法常時間上線的玩家不怕輸太多戰力，值得推薦的好遊戲
599,2017年3月9日,5,這是一個消磨時間的好遊戲，不用花長時間盯著手機，解任務又有拿不完的綁鑽，值得推薦喔！
600,2017年2月17日,5,雖然是放置型遊戲，但是一登入就不捨離線啊~
601,2017年4月1日,5,上班族首選  。  不用一直盯著手機  每天話一兩個小時就能輕鬆上手  會讓人沉迷的遊戲
602,2017年3月17日,5,上班可以專心不用一直盯著真是太好啦！要是維修的賠償也是很有誠意 大家快來玩
603,2017年3月10日,5,打發時間的好遊戲，不用一直盯著螢幕看到天荒地老，掛機就可以升級，不必擔心跟不上進度，也不必花太多小朋友就可以享受遊戲的樂趣，商城回饋也很豐富多樣，就連維修或更新都有補償，真的很不錯。
604,2017年4月21日,5,非常適合打發時間的遊戲，而且又能爽爽領鑽石提升最大戰力，小編客服都會馬上回覆，很用心，值得推薦一玩。
605,2017年5月10日,5,不錯的打發遊戲時間 可以讓上班族偶爾玩玩手遊交朋友
606,2017年4月21日,1,今天改版卻讓神器無法買怎麼越改越爛，叫我要密小編結果封鎖我臉書，怎麼會這樣呢？
607,2017年3月11日,5,整體來說已經很棒了 但還是有很多可以進步的空間 真的很好 要繼續加油
608,2017年3月15日,5,還不錯玩，小課也可以玩很久，希望官方可以再大器點大方送讓大家可以體會遊戲的樂趣
609,2017年2月21日,3,我在38服 請問為何一子被擠出來，顯示爆滿爆滿。 維護中2分鐘後開啟。 維護快4個小時了，還要維護多久?
610,2017年4月3日,5,這遊戲很不錯 金這遊戲很不錯 金幣取得方式很多 活動的東西 鑽石 都送的很大方 適合休閒的人玩
611,2017年4月9日,5,遊戲不錯玩哦…不用一直盯著螢幕看，也能夠打怪 升級，遊戲操作不複雜 易上手，蠻適合消磨時間玩的，還有小編們的用心，都會一一回覆玩家的問題，而不是只是用系統回答問題，這點很棒哦！
612,2017年4月26日,5,不用特別花時間盯著手機，離線也可以累積經驗，適合比較忙碌但又想有點小樂趣的人，推
613,2017年2月19日,5,好玩的遊戲，簡單明暸，最主要是上班他也會自己玩，節省很多時間，風格有點暗黑味道，玩到停不下來，就算掛機還是會想開來看，耐玩
614,2017年3月1日,4,好玩的遊戲，重點是不用一直盯著螢幕可以輕鬆練級升等，客服也有在認真解決玩家的問題。
615,2017年3月17日,5,之前 英雄 重製星級的同時 當下 獎勵 沒有收到  要 重開才有   不過  遊戲不錯     戰力 好像沒那麼準  評斷方法 可能要微調一下  3萬可以打贏5萬的 網路比較慢 會當機 要重連   但整體還不錯   讓我熬夜的好遊戲
616,2017年5月5日,5,這是很好玩的一款遊戲，不用一直開著手機卦著，也能夠打怪，不用擔心上班偷玩被老闆抓到gg了！！
617,2017年3月17日,5,玩了這麼多款遊戲！只有這個能不用整天注目著偶爾撥一點時間整理！  送鑽石方面不手軟！讚！  問題解決能力又強！gm不厭其煩的回答我所有疑問！指導我大方向的玩法！辛苦了！  問題解決速度是很多遊戲沒辦法解決的重點！
618,2017年2月13日,5,感覺服務態度超優處理方式很人性化，遊戲也好玩，才剛玩就迷上了，不過建議線上還是需要有留小編的fb聯繫方式，這樣新手玩家有問題，才不會跟無頭蒼蠅一樣哦，最後還是感謝小編的處理幫助哦
619,2017年4月24日,5,還不錯、覺得可以在背包寶石的介面上，多一個寶石轉換的按鈕，這樣就不用每次都要點到鑲嵌寶石那裏囉
620,2017年3月27日,5,很不錯的手遊 很耐玩 離線掛機很方便 不會被遊戲綁死死的 官方很用心又大方 推推推
621,2017年4月15日,5,手遊本來就是為了打發時間來玩的. 這遊戲可以忙碌時工作.空閒時專心衝裝 休復補償給的超大方 真的沒的比！！！！
622,2017年3月18日,1,弓箭手氾濫的要死，閃避流一堆，法師沒任何其他優勢還要搞命中，平衡調整也很雞肋，完全沒有切中要害。
623,2017年4月19日,5,這遊戲不錯，下線也會自己打怪，送禮也滿大方，雖然還不會玩但還是買了月卡天天領元寶，讚
624,2017年4月18日,5,還不錯的遊戲，不大需要花很多時間關注，對於忙碌人來說，只要利用短暫時間上去看一下就可以了！
625,2017年4月23日,5,這是一款非常棒的遊戲，活動很多也非常的遊戲幣可以領取，希望大家多多支持.我在s93等你
626,2017年4月8日,5,不用一直盯著螢幕就能升級 真是上班族首選遊戲  遊戲內容豐富  上手容易 快點加入一起玩吧
627,2017年3月17日,5,不錯玩  活動多   但幸運寶石能否改能合成大的幸運寶石   小的……1千多顆 手會按到抽筋
628,2017年4月21日,5,這遊戲真的很敢送，即使稍微維護馬上有補償可領，也不用一直盯著螢幕打怪打裝升等，忙完或睡個一覺起來滿滿的裝備等著你...
629,2017年3月9日,5,真的是一款不用耗費太多精神跟時間在手機上，最適合上班忙碌的人玩，就算離線依然會繼續練功，雖然是一款輕鬆手遊，但是等級還是稍微難爬了點，其他部分活動都還蠻優質
630,2017年3月1日,5,不錯玩阿，鑽石送很大。上班族最好的遊戲，雖然連線品質不好，但是鑽石很敢補償，有時後滿希望繼續不好的哈哈
631,2017年5月5日,5,超喜歡這遊戲的.自動練功很方便.我就可以忙我的事情.畫面也華麗.這款遊戲很像我以前玩的pcGame奇積.所以姐玩的不是遊戲.是回憶XD!
632,2017年3月11日,5,每天掛著應該就不成問題，很適合想玩遊戲又沒什麼時間的人玩，每天記得登錄看看就行了
633,2017年4月1日,5,不錯的遊戲，不用整天看著螢幕，眼睛不會酸累，偶爾上線用個小任務及活動即可，也不太會花台幣，適合小上班族！
634,2017年3月7日,5,好玩好玩好玩很重要所以說三次！上線七天感覺遊戲很多活動不會很單調，有異常馬上處理還有補償，推～
635,2017年3月9日,5,像我這種很少時間的人，這個遊戲很適合我，雖然新手教學較少，但也送新手很多東西，懶人可以來試試看
636,2017年2月18日,5,以為就是如出一轍的遊戲，玩了ㄧ下就停不下來，就算沒玩，還是在練功打裝，完全不綁你時間，是上班族很好的休閒選擇。S33，ID海量恩。歡迎大家一起來玩。
637,2017年4月23日,5,只需要偶爾上線整理背包，解每日任務就好，對沒時間長時間盯著遊戲的人可以消磨時間，不錯的遊戲
638,2017年2月28日,4,遊戲雖然主打 ，簡單易上手不暫時間， 但是常常物品的來源與用途都搞不清楚 ，最好能夠設一個連結 ，有系統的交代物品的來源與用途
639,2017年3月14日,5,你們遊戲真的很好玩很不錯在我上課不能玩手機的時候有你們的遊戲在真的很好可以離線掛機衝等級
640,2017年2月21日,3,怎麼一直在維修  不然就是一直暴滿 進去不到五分鐘又斷線
641,2017年3月17日,5,遊戲不錯玩  可是明明網路OK卻時常顯示網路不穩 而且常常閃退 最後太難贏過課金玩家了😂😂
642,2017年4月8日,5,上班族打發時間的好遊戲 下線也能夠完全自動練功 值得玩家試試看 辛苦小篇
643,2017年2月22日,5,很方便 同時練幾個號都不太費時 問題解決很快 送的也很多 讓人愛不釋手
644,2017年3月7日,5,這款遊戲適合沒時間玩的人，２４小時自動掛機，內容多元化豐富，而且送東西又大方，不玩太對不起小編了。
645,2017年4月15日,5,這是一款很不錯的遊戲，工作再忙還是能衝等，不必為了衝等在工作時而分心，且更不用一直盯著螢幕在玩，讓眼睛能夠有足夠的休息時間....
646,2017年2月22日,5,第一次玩到可以掛機的手游，這樣上班也可以練等，而且復古畫面有暗黑二的懷念感覺。
647,2017年3月9日,5,很讚的遊戲 無論上班也可以顧到 爽 不用擔心 跟不上 一起衝吧！
648,2017年4月18日,5,厭倦了 一成不變的打怪練功遊戲 ，懶人遊戲？ 不不不  ， 這是款 內建練功 讓我不在打怪練功模式拼進度。 暗黑 模式的爽快噴寶，  重點來了。  練功   跟其他動作解任全部分開進行，任務 解的漫  聊天聊太多沒關係， 繼續默默不語的練功打怪。
649,2017年3月7日,5,不用花太多時間在繁瑣的戰鬥過程，專心於人物培養，很適合上班族以及遊戲時間不多的人
650,2017年2月17日,5,這遊戲真好玩 都不用害怕沒時間上線 因為他會自動幫你練功
651,2017年4月10日,5,很不錯的手遊，了解玩家不一定有很多時間一直上線，兼顧玩家想要快速升等的需求，感謝你們的用心。
652,2017年3月17日,2,評5星的都只是想拿1千鑽石， 伺服器塞車問題很多天了沒有解決， 剛開始還會斷線重開，送150鑽。 後來都置之不理，熱門時段一直轉轉轉 心情就很差，玩家怎麼敢再儲值？
653,2017年4月21日,5,非常好玩的遊戲+很有誠意的公司，小編回覆速度也很快，很熱心～ 第一次玩手遊感覺很不錯！
654,2017年4月13日,5,不需要時常關注遊戲 只需要有時間上去關注一下 就可以練等 這是一個好遊戲
655,2017年4月21日,5,問題反映馬上回覆 協助處理  又有補償 實在是很有責任又有效率
656,2017年3月11日,5,不用一直處在遊戲畫面很方便 輕鬆練等 鑽石又給的大方 適合上班族玩～
657,2017年3月21日,5,不錯的掛機遊戲 不需要整天盯著螢幕 詐騙訊息 外掛也能夠使用臉書即時 處理
658,2017年4月28日,5,這是一款讓忙碌上班也能輕鬆玩的遊戲值得推薦非常不錯加油
659,2017年3月23日,5,完了三天嘍~玩了這麼多遊戲，終於找對屬於自己想玩遊戲，讓上班族的我，玩的輕鬆，不佔時間，也希望官方能維持現況，不要弄的太複雜，謝謝
660,2017年4月1日,5,蠻適合忙碌上班上課的人玩的手機遊戲，不用一直盯著手機，24小時掛機，休息時間進去遊戲過任務即可，離線也可以打裝備獲得經驗！獎勵很豐厚，小編及設計團隊非常用心，辛苦了!
661,2017年5月4日,5,Good 非常好的遊戲 每天有不同的活動禮物可以增加遊戲興趣 希望節日時可以增加一些活動 謝謝
662,2017年3月27日,5,不需要常時間看著銀幕 ，很休閒 ，只是感覺跟其他玩家的互動性合作可以在多一些
663,2017年3月18日,5,不錯的遊戲，讓需要上班的人可以不用擔心等級跟不上別人，另外鑽石也給的很大方
664,2017年2月18日,5,真的非常好玩，強烈建議下修精英調挑戰6關之後的關卡，真的太難了，不鼓舞都打不過，不過其他點真的都很棒，給5星😄
665,2017年5月3日,5,謝謝你們讓我有這麼一個可以簡單又不失有趣的遊戲可以遊玩，獎勵也送的相當大方，辛苦各位了😉😉
666,2017年4月16日,5,一款相當不賴的掛機遊戲，忙人可以在休息時少少花一點時間上線過過個人任務或換換裝備，戰力可以通過許多管道提升，是一款值得思考計算的手遊，以及無時無刻送好禮，大推無盡戰記。
667,2017年2月20日,5,掛機還不錯玩~ 簡單滿好上手的，希望多充實遊戲內容不要讓好遊戲那麼快就倒下！
668,2017年4月18日,5,這款遊戲超好玩的 很建議大家 還有裡面鑽石發放不手軟 快來下戴吧
