,Date,Score,reviews
371,2017年3月18日,5,這個遊戲還不錯玩  而且功能還比別的遊戲好也很多  掛機方面的功能也很實用性  感謝此手遊的各位製作者跟小編大大的用心  本人希望能有更突破的性質 來提升更多玩家的讚許  謝謝
372,2017年4月23日,5,可以很放鬆玩的一款遊戲。不用一直看著手機 偶爾上來整理 任務也不會花太多時間。適合學生玩 不會花費太多時間在上面。
373,2017年4月25日,5,很久沒看到FB廣告影片跟遊戲內容一樣!一定要給誠實的廠商支持一下，遊戲送鑽也很大方
374,2017年2月22日,5,我很少在遊戲評分的 這遊戲簡單確很耐玩，小編更是讓人覺得貼切，不像其他遊戲的回應永遠只是複製在貼上，支持你們 加油！
375,2017年3月27日,5,還不錯玩的遊戲 簡單易懂 重點是 不用一直看手機也能自動打怪升級 好玩
376,2017年2月19日,5,對於沒時間的人來說真的超方便全自動真的只有爽到翻天還可以跳出看小說爽啦
377,2017年4月25日,5,這是一款只要你設定好就能一直玩，會自動幫你練等跟裝備的遊戲，不用一直顧，適合上班族跟學生還有時間比較不方便的人一起玩喔
378,2017年3月25日,5,相當好玩的一款遊戲即使工作忙碌也可輕鬆掛機，不用被時時盯著螢幕，裝備容易獲得，即使是第一次玩手遊的玩家也能輕鬆上手，值得推鑑
379,2017年2月18日,5,不花錢也能贏花錢的玩家 但要贏砸萬的玩家很難啦哈哈 但很有樂趣的遊戲值得大家參考唷
380,2017年4月24日,5,感覺挺不錯的，也不用花太多時間在遊戲上面，挺適合像我這種工作時間很長又很想玩手遊的人遊玩。
381,2017年3月28日,5,對於上班族來說這是一款不錯的遊戲，伺服器有問題也都立即就解決了。小編也都一直很照顧玩家哦！
382,2017年4月14日,5,這個游戲最大的消遣在上班忙碌無法看手機時仍能自動打怪，無聊時可以解任務消遣時間，又不時會送鑽石增加游戲意願，蠻不錯的游戲喔～
383,2017年3月27日,5,不需要花台幣也可以輕輕鬆鬆的玩，每天隨著指引稍微花點時間就可以完成任務，簡單又值得一玩的掛機遊戲，做的很棒。
384,2017年4月10日,5,這款遊戲很棒，不用24小時盯著螢幕，相信對於大多數人是一個福音，這款遊戲會24小時自動打怪，而且掉裝備的機率蠻高的，最重要的是送鑽石毫不手軟
385,2017年5月4日,5,非常好玩的遊戲 不用一直掛在線上 讓一些比較忙碌的人也能玩 不會說跟不上進度
386,2017年3月28日,5,實在是棒到一個極限，這是我有史以來玩過最好玩的遊戲，當然好遊戲就是要給五個星啊！ 加油希望你們能創作出更多更好玩的遊戲！
387,2017年4月28日,5,不錯遊戲  不用一直盯螢幕 離線也會自動打  送鑽不手軟  非常適合上班族休閒
388,2017年4月12日,5,不錯的遊戲，可以不用一直盯著螢幕看，有時間去做自己的事， 不只適合上班族也很適合家庭主婦喔 ！小編解決問題回覆也很快速
389,2017年2月17日,5,這款遊戲真的超適合有小孩子的我，不用常常盯著手機看，等到忙碌完就可以看看打到那些寶物或者升級裝備，真的值得下載來玩。
390,2017年4月13日,5,不錯的遊戲 在忙碌的工作可以不用花時間玩 離線練等打裝備 很不錯 可惜的是這遊戲缺乏交易系統
391,2017年4月14日,1,光神器+幸運傳承要近2000萬    刷金幣點刷了4小時沒出現過300萬 也沒自動刷非常爛
392,2017年2月24日,5,遊戲好玩容易上手~又不用整天盯著螢幕!不管是上班族還是什麼職業都非常適合那麼讚的掛機遊戲哪找勒!快來加入吧！
393,2017年3月18日,5,非常適合我們上班族玩的一款遊戲。沒時間上去玩也不需擔心沒練到工，加上送寶物送的很阿沙力。 是我進幾年來玩過最好的一款手遊
394,2017年4月13日,1,為何現在進入礦中一直顯示我VIP等級不足？ 就算0等也可以挖礦吧 我目前3等不能入嗎？伺服器67
395,2017年3月19日,5,不用像其他手遊忙著練功 鑽石也送很大 整體到目前玩起來都不錯
396,2017年3月17日,5,還不錯 第一次接觸手遊就不小心上癮了 處理bug速度很快 離線會繼續練等不用擔心沒時間玩 還不需要像其他線上遊戲一樣一定要砸很多錢才會強
397,2017年3月2日,5,對平常較沒時間卻想再閒暇之餘舒心的玩家來，還不賴，不用整天盯著打怪升級配裝等 只須偶爾上線整理過小任務及活動即
398,2017年3月26日,4,難得看到可以不必上線就可打裝備練等，實在是造福現代人忙碌的一個好先趨
399,2017年3月19日,5,是一款不錯的手遊，不用一直盯著手機解任務，想玩就玩還有小編24小時為你解決任何問題，真是讚
400,2017年3月16日,5,這是非常好玩的遊戲 上班族可以來玩 不用一直盯著打怪 也不用花太多錢 都會送賺石
401,2017年5月5日,5,很人性化的遊戲 不像很多遊戲都需要無時無刻在線上 鑽石也可以透過很多管道取得 大家快來玩
402,2017年3月14日,5,不錯的遊戲 不用一直盯著打怪練等 休息時間點進去過過任務就好了 每次升等還會送鑽石
403,2017年3月17日,5,一款看起來平凡的遊戲 卻有很多不一樣的驚喜 也不用整天盯螢幕看 很適合上班族玩的一款好遊戲
404,2017年4月22日,3,很不錯 不需要時常盯著手機練等 離線也能升級 線上工作人員很敬業 隨時回覆解決問題
405,2017年3月27日,5,不錯玩 輕鬆的遊戲 不用整天盯著看 小編會回訊息 而不像其他款的遊戲 都只會回官方話
406,2017年3月17日,5,好玩又充滿刷寶的樂趣 很建議給上班族玩 不用一直整天盯著玩 又可自己打怪  真是Cool
407,2017年3月18日,5,遊戲蠻不錯玩，客服處理速度很快速也很盡心，送鑽以及活動都很不錯，而且最大是不用花太多時間顧遊戲，對上班族來說算是簡單的。
408,2017年4月6日,5,第ㄧ款讓我久留的手遊，可掛機送鑽又不手軟，雖然偶爾伺服器爆滿被強制推出，但馬上就能再登入，覺得棒
409,2017年4月18日,5,還不錯玩:)   非常適合上班族  還能離線打怪  有空時上線清包  等級也會自動提升   客服回應也快  好遊戲值得跟大家分享@0@
410,2017年3月14日,5,這是一款很好玩又可以打發時間的手遊，連離線它還會繼續幫你打怪賺經驗值！值得大力的給它推一下！！
411,2017年3月28日,5,簡單好上手，但為什麼會有38萬戰力裝備非常普通的還能打贏52萬戰力的玩家，這有點扯，是不是有bug
412,2017年4月6日,5,適合忙碌的上班族玩的一款遊戲，不用花時間去衝等只要有空的時候解任務清包包就好，好玩。
413,2017年4月25日,5,休閒小遊戲 不用花太多時間就可以享受樂趣 小編很用心 送鑽不手軟喔
414,2017年3月4日,5,很好玩的遊戲 不用一直顧著銀幕 偶爾上線整理背包 等級也一直提升 很適合上班族 大推
415,2017年2月27日,5,這個遊戲說真的，是我玩過那麼多遊戲，可以用最少的時間去玩遊戲，又可以不用落後其他玩家太多的。簡單說 方便 好玩 省時非常讚
416,2017年2月17日,5,比起之前玩過的類似遊戲更有趣有問題時也處理快速更重要不會拼死要求玩家課金
417,2017年4月22日,5,非常好玩的一個遊戲 不用盯著一直玩 每天上線打活動推推副本 很好消磨時間的遊戲
418,2017年3月27日,5,真是一款好玩又非常有效率的遊戲，讓你不用花太多時間就能練高等，重點是超誠意的一直送送送~
419,2017年4月18日,5,這是一款還滿好玩的手遊，不需要時刻盯著螢幕，花大時間去玩，就算離線狀態之下，遊戲還是在運行，還有就是GM 的處理速度跟回應都是滿快速的
420,2017年2月18日,5,上班時間不需要死盯著螢幕你也可以享受遊戲的樂趣歡迎你的加入我在s22 扶桑浪人
421,2017年2月18日,5,真的不錯玩為了上班沒空長時間玩有戲的人設計的但是畫面能在提升的話就更棒了
422,2017年3月22日,5,不錯的遊戲，不需要花太多時間專注在上面，而且離線後也會繼續練功，是非常適合上班族工作繁忙之餘的休閒手遊。
423,2017年4月3日,5,看到評價很高就進來玩玩看，遊戲果然如評分一樣用心，活動跟客服都非常棒，希望能長期維持下去 加油
424,2017年4月2日,5,"好玩,也不用花很多時間在上面° 頻道上有一些騙人的訊息也很快被處理完畢,這是少見的° 感覺真的有在用心經營遊戲"
425,2017年4月1日,4,拿來打發時間還不錯，只是常常伺服器爆滿，好友系統感覺作用不大，或許可以再多加點好友互動的活動會更好。
426,2017年3月11日,5,是一款簡單上手的手遊，很適合上班族或是學生的遊戲，不用花太多時間在遊戲上也能輕鬆升級打寶，客服的服務也是不在話下，優質的公司造就優質的服務。
427,2017年4月29日,5,整體來說是款好玩的遊戲，一不小心會花很多時間在上面，本身就玩了3服各職業都玩，唯一美中不足是希望各職業能平衡一下，弓手實在太簡單就能衝等。
428,2017年3月25日,5,一款不用一直盯著遊戲練功也可以跟上大家的遊戲，看的出開發團隊的用心，不斷的有回饋活動，不需要花錢也有鑽可以使用，推推唷！
429,2017年4月26日,5,這是一款很棒又省電的遊戲，可以不用一直盯著手機，在忙碌情況下還可以繼續練，所以這是一個很輕鬆方便的好遊戲唷！
430,2017年3月5日,5,不用一直花時間去盯的好遊戲，小編也很用心的解決玩家的問題，是一個有在認真經營的好手遊，真心推薦給大家！
431,2017年4月15日,5,真的很適合沒能長時間上線的玩家，GM的處理速度也很棒，不用是一等再等的節奏 藉由活動也能讓沒儲值的玩家盡情的玩 玩過幾款掛機手遊，唯獨這款會讓我著迷
432,2017年3月11日,5,"遊戲簡單容易上手,適合上班族的手遊,小編處理遊戲及問題的速度不在話下,送鑽的大方讓玩家爽度破表,這樣的遊戲不讓人愛上也難呢！"
433,2017年3月30日,4,第一次遇到可以偷懶且適合上班族的遊戲，雖然還在摸索中但感覺玩法多樣值得嘗試.
434,2017年2月18日,5,還不錯玩！只不過副本少、希望能增加血盟組隊副本能刷寶物神裝！還有聊天系統怪怪的！還有遊戲內容再不趕快增加的話玩家正在快速的流失中！快大改版吧
435,2017年3月22日,1,我是65服的玩家，腳色叫公西苻美，為什麼我的禮包沒領到就被刪除，上面明明寫領過的才會刪除，是否可以將禮包還我
436,2017年4月26日,5,這款 遊戲有自動掛機真方便 ，不需太多時間在打怪獸升級 加強裝備，每天輕鬆玩是很好的 休閒遊戲 ，不想玩複雜 和長時間 遊戲的朋友，來一起玩啦！
437,2017年4月6日,2,很疑惑技能明明耗魔不大，但只要被打魔就消耗光了，這樣怎麼放技能，每次技能放一輪魔就被吸光啦，怪物個個都是吸魔大師，那要技能做啥呢
438,2017年5月4日,5,"享受遊戲又不用一直開著手機,電量也不會因此大量損耗,適合像我這種超級懶人型玩家,給推"
439,2017年2月25日,5,遊戲容易上手，對忙碌的工作者或學生都能輕鬆玩樂，遊戲中出現問題都能立即通知並且積極搶救，非常棒，推薦這款遊戲，給于五星評價肯定
440,2017年3月9日,5,不需花太多時間練工遊戲中掛機系簡化遊戲的手感疲勞度是款不錯玩的遊戲，小編也是有問必答
441,2017年3月16日,5,玩過這麼多款手遊，這裡的小編是真的很用心在幫玩家解決問題，補償也從不手軟，真的很大心的一款遊戲！
442,2017年3月22日,5,遊戲會送鑽石 可以輕鬆玩 內容有趣 頻道都還蠻多活人聊天 很不錯
443,2017年2月20日,5,"小編熱情 ，活動每三天都會更新一次 遊戲內容又不錯,不好的地方都會進行改善,也願意聆聽玩家的心聲,歡迎新人 不太會技巧的 來38服 我是 叻少丶 , 願意提供心得"
444,2017年4月13日,5,找好久才找到的遊戲！不用花太多時間在遊戲上一直看……一有空馬上上線就ok非常適合上班族遊玩的遊戲.小課金也能玩的很開心、非常用心的遊戲
445,2017年2月17日,5,喜歡這玩法，只是晚玩造成七天限量999個的活動拿不到，建議還是可以用每人限定一份就好，不然晚快一天玩，結果拿不到。
446,2017年4月27日,4,不錯玩 簡易上手希望畫質能夠再細膩點會更棒 另外一提：粉專一直無法登錄…
447,2017年4月12日,5,非常不錯的一款游戲。輕鬆也容易上手。最重要的是離線還可以24H幫你練功升等。發鑽也不手軟。游戲團隊服務度也是很好。非常支持你們。加油
448,2017年3月29日,5,非常有趣的遊戲，能不用盯著手機看就可以升級，讓每次忙完後再次上線都會期待自己的成長，值得推薦的遊戲！
449,2017年4月2日,5,不錯遊戲，不再擔心沒時間上進度落差太多，無時無刻都在練功，只要上線整理一下即可，對忙碌的人實在是很好的遊戲
450,2017年5月1日,5,在聊天室有玩家在喊賣洗版，有其他玩家去反應，GM大大立刻去處理，真的很有效率，除了讓大家有一個非常好玩的遊戲跟聊天平台，還有一個很用心的無盡團隊。
451,2017年3月22日,5,本來不玩手遊的我，接觸到無盡戰紀之後就愛上了，24小時掛機不用怕玩的時間少跟不上別人，裝備多元化，活動又多，就夠我玩的不要不要了。
452,2017年3月9日,5,還不錯玩，不用一直在線上遊戲，下限也有經驗可升，只是一些功能不會提醒 像活躍度到了，沒注意會不知道去領
453,2017年3月12日,5,不用時時刻刻盯著手機，下線也能自動打怪昇等打裝備，還會不定時舉辦活動送賺石，真是不錯的遊戲。
454,2017年4月25日,5,我一開始是用遊戲登路後來用FB登錄，結果把我的遊客帳號給覆蓋掉，能否還給我遊客帳號，因為我那個玩比較久
455,2017年4月13日,5,不錯玩的遊戲 ，至少不用一直盯螢幕  ，就能掛機打怪 ，裝備一鍵套用  比 一按進去還要脫裝備在換新裝備的遊戲 好很多，很方便的設計 。
456,2017年4月11日,5,完全不用花費太多時間在遊戲上，空間時間在開來玩，也不用緊張打不到限時關卡，真的很適合工作忙碌的我，因此給滿星，遊戲團隊你們也辛苦了～
457,2017年4月23日,5,非常容易上手的遊戲，尤其是在離線時候，系統還能自動打怪練等，等時間一到上線解活動任務就可以了
458,2017年4月16日,5,一個好玩到不行的手遊 完全不用擔心時間的困擾 離線打怪上線配裝即可 讚！
459,2017年4月5日,5,非常值得玩的一個休閒遊戲 放著還能自動打怪練功，重點是完全不像其他遊戲 需要一直盯著手機
460,2017年4月1日,5,很適合沒時間玩遊戲的族群，可以離線掛機，每天的打boss活動也會自動參加，不囉嗦給五個星
461,2017年5月6日,5,沒想到這麼好玩 我已經把電腦給丟了 女朋友也分了  s100  id無敵大麥克
462,2017年3月3日,1,不覺得好玩！看起來簡單方便！說白了不就是搞vip看誰儲值的多的土豪遊戲！沒樣東西都要鑽石！而且還不便宜！天天開新服！炒短期的遊戲看多了！過然是免費的最貴
463,2017年3月22日,5,這款遊戲讓工作忙碌的人也適合玩，只要掛著，有空的時候清理一下背包就好，鑽石送的也很有誠意。很適合不想要盯著螢幕或沒時間的人遊玩唷！
464,2017年5月1日,5,遊戲好玩  可掛網練等  輕鬆玩 無壓力  而且24H都有管理者在線上服務
465,2017年4月28日,5,很好玩的遊戲很適合上班的人玩不用一直盯著手機，遊戲內容也蠻豐富的，更重要的是GM很關心遊戲，很快就會處理反應的事，是一款很好玩的遊戲。
466,2017年4月8日,5,玩法簡單，不會消耗很多時間在遊戲上，每日任務解完就可以放著讓他自己打怪，相當不錯玩的放置型遊戲。
467,2017年3月22日,4,遊戲很好玩，掛機制度也很適合學生，但是伺服器常常不穩定，尤其是用行動數據的時候，都會一直跳出玩家爆滿，希望可以加強一下伺服器
468,2017年4月1日,4,拿來打發時間還不錯，只是常常伺服器爆滿，好友系統感覺作用不大，或許可以再多加點好友互動的活動會更好。
469,2017年3月5日,5,請問我有在iphone用facebook帳號玩 可是我換安卓同一個Facebook 同一個伺服器竟然沒角色……?請問怎麼這樣子 -
470,2017年4月23日,5,這款遊戲，讓我不用長時間盯著手機看也不用擔心打不到自己所需的裝備連包包滿了也會通知，真是不錯的遊戲，我在s59當等你一起玩^^
471,2017年5月1日,5,第一次玩掛機遊戲  不用一直叮著手機看 真的很棒 打發時間好選擇
472,2017年2月18日,5,雖然不開遊戲也能自動掛機 但還是忍不住想一直開 真的是上癮了!!!只可惜常出現網路不給力 可訊號是滿格的!
473,2017年3月17日,5,越玩越上癮  而且有問題都有專人處理 不會反應都沒人處理 絕對是一款值得長期玩的遊戲
474,2017年3月16日,5,遊戲好玩又方便不用顧著練，打發時間非常好，而且小編非常用心有問題馬上處理，只有讚而已大家快來下載好玩啊！
475,2017年3月24日,5,是個可以輕鬆玩的好遊戲，不用為了裝備或是任務而被綁住時間，工作團隊的效率高，也很樂意幫玩家解決問題，值得各位來嘗試看看。
476,2017年5月3日,1,你口中的退費並不符合google play的退款政策  寄信給你們也不回……說好的願意為我退費並回收帳戶呢？
477,2017年4月14日,4,非常推薦這款遊戲不需儲值就能變很強而且不用盯著螢幕一直看，掛一掛我就發現我40等了希望官方能送多一點東西！這款遊戲真的很棒，很值得下載它.
478,2017年4月19日,5,24小時自動戰鬥太方便啦！不用每天盯著手機，對學生跟上班族非常友善，沒課金也可以玩得很開心～
479,2017年5月1日,5,適合小玩的遊戲，裝備好收集。 也不太花臺幣。 自動掛網打怪輕鬆升級不用每天固手機
480,2017年4月15日,5,好玩又耐久的遊戲  只是玩上去之後  點數 要花很大才能強   請把東西的價格調低  謝謝
481,2017年3月23日,5,非常好玩的一款手遊~送鑽石也不手軟，不用整天盯著銀幕看升級配裝等，只需偶爾整理背包 過任務 也不用花太多臺幣 適合上班族一起玩喲，客服也24小時在線上
482,2017年5月3日,5,非常棒的一款遊戲，不用一直盯著手機看打怪也能升等配裝背及任務小活動，另外送鑽石也不手軟，真的很適合上班族玩唷…大家快下載吧～
483,2017年4月28日,5,近期內玩過不錯的遊戲  一開始玩覺得內容單調但是玩個三天之後發現內容其實蠻豐富的
484,2017年4月12日,5,不錯玩 不用一直盯著手機 有空上線整理一下就好 希望有更多的新活動
485,2017年2月26日,5,很輕鬆自在的遊戲 希望推出更多活動 爽感滿分 感謝小編的辛苦 讓遊戲品質保持下去
486,2017年4月5日,5,這是一款適合各年齡層玩家，不需要花太多時間在遊戲上，就算沒上線，腳色依然可以繼續練功
487,2017年3月22日,5,很棒的遊戲~不用一直盯著螢幕打怪，鑽石也不會說一定要儲值很多才能拿到，不過希望能添加主角與英雄的陣型，位子互換之類的，能讓英雄在前面坦
488,2017年2月27日,5,是一款很輕鬆又玩不膩的遊戲，目前沒遇到什麼困難。 只是不懂集字要怎麼收集，因為背包目前沒看到字。
489,2017年4月14日,5,不錯的遊戲~以往的遊戲要緊盯著 忙碌的我無法好好解任務 著款遊戲超讚的…… 就算忙人物也在練功升等喔 😉
490,2017年3月10日,5,還不錯的遊戲，不用一直到處跑，只要花點時間注意任務跟提升人物戰力就有很好的體驗 ! 重點還可以培養自己的戰友，一個帳號享受不同職業的趣味 !讚讚 !
491,2017年4月1日,5,不用一直糾結花很長時間在遊戲上過任務。而且24hr自動打怪很喜歡，遊戲幣也不會很難賺，送鑽石也不手軟。製作這遊戲的老闆真的很大愛。非常適合沒辦法長時間玩遊戲的上班族！
492,2017年3月29日,5,"好玩的ㄧ款遊戲,不用整天等王 很體諒上班族花費少量時間就可以玩的愉快"
493,2017年3月31日,5,我用一般用戶登入玩了一段時間，今天誤觸FB 登入，結果一切歸零。有辦法恢復到我原來的等級及裝備嗎？ 謝謝小編在那麼短的時間內就將問題解決。大力的推推！
494,2017年2月22日,5,遊戲很好玩唷 也不會每天都要一直顧手機 鑽石也送滿多活動也不錯 值得玩看看
495,2017年4月16日,5,一個好玩到不行的手遊 完全不用擔心時間的困擾 離線打怪上線配裝即可 讚！
496,2017年3月3日,5,很讚的遊戲，離線掛機也能有所成長，不用擔心沒時間玩跟不上，而且遊戲公司很大方送VIP、超多鑽石跟金幣還有道具。
497,2017年4月24日,4,復古風格的遊戲，相當耐玩。但是等級升級到一定等級後，缺乏其他挑戰與冒險。而遊戲中如有其他團霸佔血色城堡，其他團無挑戰與反盤機會。進而喪失遊戲樂趣。
498,2017年3月4日,5,"24小時自動練功,打裝不需要顧著. 合成滿方便的 gm又常常出現,處理遊戲問題 真的很不錯"
499,2017年4月8日,5,真的是蠻好玩的遊戲，很適合上班足，偶爾去整理一下裝備及領東西就好，算近期玩過最有趣的手遊!
500,2017年4月1日,5,很替上班族群著想，下班回家也不用怕沒練到功或哪個任務沒解到，有小孩的更累，一邊玩還要顧小孩，這遊戲不同，可以丟著，完全不用怕沒練到，很好的遊戲公司
501,2017年4月17日,5,"送鑽不手軟,遊戲本身也真的極適合上班族與上班族與時常沒空捧著手機玩的族群,非常優秀的遊戲"
502,2017年3月7日,5,放置型遊戲內部畫風比起以往的那些確實比其他來的高，雖然還有其他的進步空間，遊戲對於我來說畫質、內容、活動等，講究的其實也挺不錯的，雖然這是一款放置類遊戲。
503,2017年4月15日,5,"小弟個人心聲覺得無盡戰記這遊戲是我玩過最好玩的，也請各位沒玩過的玩家們快點來玩,"
504,2017年3月3日,5,是一款特別而且讓玩家會愛上的遊戲 迷人的離線掛機更是讓人愛不釋手，想不玩都困難，繼續加油！
505,2017年3月17日,5,滿推的一款手遊，會不定時推出新活動，不定時優惠遊戲商品，輕鬆玩零壓力，就是覺得練功升等滿無聊的沒互動
506,2017年4月26日,5,可以玩遊戲不用太發時間，隨時可上線又可掛機，有經驗質又小會掉寶升等，是一個不錯的遊戲  ，小編隨時回覆你，快速服務又好
507,2017年3月21日,5,期待著每次上線的驚喜， 不須花費精神和金錢， 就算是掛機也很耐玩， 重點是在於用心處理的團隊， 造就成存在感而不敗之手遊。 團隊的用心，玩家深深體會。
508,2017年3月18日,5,請問客服，我原本用遊客登錄並遊玩一段時間，我覺得這個遊戲滿好玩的，所以改選用facebook登錄，但一登錄，我之前遊客的帳號不見了，直接重新選人物，請問能有解決的辦法嗎？感謝
509,2017年3月28日,5,終於找到一款不用隨時盯著螢幕和追著時間跑的手遊，值得推薦給時間較少，想玩手遊的人。希望之後能有更多驚喜😊😊
510,2017年3月30日,5,還不錯的遊戲，可以免費自動掛機，不用一直開著螢幕浪費電，很多活動也都會送些金幣跟鑽石，讓新手玩起來很輕鬆！
511,2017年3月15日,5,還不錯玩，每天花點時間整理一下東西，解個任務，不用一直盯著手機也可以輕鬆玩，最適合工作中休息一下打發的遊戲，送的禮物活動也大方。
512,2017年3月5日,5,有別於現今市面上充斥的卡牌手遊，無盡戰記這類型的RPG，更讓六、七年級的玩家更為喜愛啊~也希望遊戲可以提供更多元化的活動給玩家！
513,2017年4月24日,5,操作蠻簡單的，有自動練功就不用特意去關注，實力自然就起升，偶爾上去整理裝備就ok，總之是一款還不賴的遊戲 不過建議帳號綁定能多元化(提供google帳號綁定)
514,2017年2月18日,5,以放置型手遊來說介面做的不錯，然而強化 追加極品之類的功能就有待加強，新手玩家很容易不知道該從何提升自己的實力，但整體來說非常好玩又不花時間。
515,2017年4月10日,5,雖然剛玩幾天還再摸索中，可是我覺得還不錯玩，不用一直把電話拿再手上也可以升等打裝備。非常適合上班族，還是整天要顧小孩的家庭主婦玩。
