,Date,Score,reviews
322,2018年12月28日,5,喜歡大家，每個都好蘇，這遊戲讓人忍不住臉紅微笑
323,2018年12月27日,5,節奏剛剛好，讓人忍不住想一直玩下去，而且男主們都太帥了（尖叫
324,2018年12月26日,3,為什麼維修後信箱的東西就不見了，而且還開不起遊戲，重開機才能開
325,2018年12月27日,5,希望好友功能可以多樣點，比如用朋友的羈絆，或查看對方空間和聊天。
326,2018年12月26日,5,好玩的遊戲 都快戀愛了 只是錢不好賺 還是給五顆星
327,2018年12月29日,4,很好玩的遊戲💓 但是希望以後換專家的時候可以不要花錢
328,2018年12月29日,5,我一開始真的沒什麼興趣，我現在根本是離不開許墨了！
329,2018年12月29日,5,超級好玩，希望台版能趕快開放第十章後面的章節
330,2018年12月29日,5,陸版時就一直期待台版！劇情真的很讓人意想不到，卡片也都好好看Σ>―(〃°ω°〃)♡→ 期待以後的新活動！
331,2018年12月28日,5,超讚的！！！！ 最愛許墨了 看來不只手控 以後找男友要多一個聲控了
332,2018年12月28日,5,抽到R以上的機率算滿高的，每個角色都帥到爆表😍
333,2018年12月25日,4,很好玩，故事也很吸引人但是鑽石太難賺了，無法課金的人賺的很痛苦
334,2018年12月26日,5,李澤言說給五星換布丁，他說話算話，所以我來點五星了
335,2018年12月26日,5,深坑戀與製作人，從陸版玩到台版！必推的好遊戲，精心設計 👍
336,2018年12月26日,5,希望漫步系統可以改快一點 不然都要用很久
337,2018年12月25日,3,沒課可能玩到後面就卡關了吧，要不然其實遊戲挺好玩的。
338,2018年12月19日,5,超級讚的啊!!!!! 棋洛真的好可愛!!! 而且訊息跟通話都做得很逼真 真的非常的喜歡這款遊戲 現在的目標是周棋洛(薯片先生)的海報!!!
339,2018年12月25日,5,獎勵可以再多一點嗎 連玩遊戲都覺得窮
340,2018年12月25日,5,恢復時間太長 城市漫步有點無聊 但劇情非常有趣
341,2018年12月25日,4,關卡有些難過，很容易就卡關了，不過畫質和人物都非常的好，如果可以不課金的話可以讓我們這些不能課金的人玩起來會更好玩， 轉蛋等的有點久至少要等兩天才能抽一次又抽不到什麼好的令人有點失望 其他的部分都超級的好繼續加油喔！
342,2018年12月27日,3,我已經購買了鑽石，系統也說我已擁有此項產品，但我的鑽石量並沒有增加，為甚麼？
343,2018年12月26日,3,劇情很好，但是漫步很不好。體力與金幣可以建議多給點(暖暖這樣多好)....然後每僱一個專家就要多花一次錢也很不合理。還有，希望能夠有分解卡片的功能，例如：分解幾星不要的R、SR、SSR能夠獲得投資進去素材的1/3
344,2018年12月26日,5,超級好玩！！不會很複雜，人物配音跟畫風也超讚👍有被撩到的感覺，男主都好帥！！♥♥
345,2018年12月25日,5,畫面很美，對話很容易讓人悸動，希望可以改善一直讀檔問題。
346,2018年12月21日,3,錢難賺的要死，隨便一個升級就快讓人傾家蕩產，不太想繼續玩下去了。
347,2018年12月23日,3,說真的我比較想知道背景音樂到底是誰的歌XDDD
348,2018年12月15日,1,版本也太舊了吧，是不會把優化跟比較好的拉到前面來嗎，簡轉繁有那麼困難哦。
349,2018年12月20日,1,為何我抽到卡，它不給我呀！反應了也沒得到回應，這樣我想解安裝了！
350,2018年12月18日,5,遊戲整體很好玩，但公司名字可以免費換一次，想說名字應該也可以免費換一次吧？
351,2018年12月18日,5,要顧的東西很多，要非常有愛才會一直玩下去XD
352,2018年12月12日,1,預約的序號用都用不上我弄的那麽辛苦為啥
353,2018年12月17日,5,是說起步的時候很不錯 ，已經有五張SR惹 嘿嘿嘿嘿
354,2018年12月16日,5,我超愛的！！ 希望有方便的儲值方式 漫步也太久了吧~希望跟進陸版
355,2018年12月16日,1,無法下載資料 下載久 到後面說失敗叫我重來
356,2018年12月16日,4,總覺得不課金玩不下去 城市新聞的達標太難了(Ｔ▽Ｔ) 體力很快用完啊…
357,2018年12月15日,5,超級棒我愛這款遊戲之前有朋友們在玩
358,2018年12月13日,3,明明事前預約湊了50碎片剛剛好，結果說我沒達成
359,2018年12月15日,3,喜歡劇情，可是因為一直卡關，所以無法看到後面的劇情，導致有點玩不下去
360,2018年12月27日,5,四個男主都好帥啊~但我還是最喜歡白起了!
361,2018年12月27日,5,一開始好奇的去玩玩看，但沒想到越玩越上癮，已經愛的不適手了
362,2018年12月28日,5,身歷其境 累的時候可以填補自己的內心 超棒的
363,2018年12月27日,5,很好玩 但玩到越後面約容易卡關
364,2018年12月15日,4,1-5神秘的男人是Zombie嗎？台版配音也太沒生氣，太好笑了我還反覆聽了五遍，笑夠了之後就改成日版配音了！XDDD
365,2018年12月29日,5,擬真的聊天系統，故事情節很吸引人，獎勵也給很多，大推好遊戲👍
366,2018年12月28日,4,這遊戲會一直慫恿妳課金外都好
367,2018年12月28日,5,超喜歡的啊～～如果可以再開放羈絆卡片可和朋友交換或販賣我覺得會更好 (●'◡'●)ﾉ❤
368,2018年12月26日,5,這遊戲在我心裡印象深刻所以我給五顆星
369,2018年12月25日,5,不知道要如何羈絆進化
370,2018年12月25日,5,不錯玩 但關卡有點難過😣周棋洛和白起超帥❤️
371,2018年12月24日,5,"當初陸版時就有意願玩了,如今出了台版果斷下載!"
372,2018年12月27日,4,明明羈絆已經升星，星星等級也已經上去，但是頁面一直顯示在Level20.的狀況。
373,2018年12月11日,5,終於出台灣版了！但是配音好沒感情哦😭
374,2018年12月26日,5,覺得千紙鶴給好少好難升阿qwq
375,2018年12月23日,4,我壓縮完後進去要開始的時候都會說已關閉......每次都這樣，到現在還進不去，待改進，謝謝
376,2018年12月26日,5,很容易就沒錢沒體力 但是......還是很好玩，簡直是宅女最愛了，哈哈哈不同類型的帥哥，完了完了陷進去了😂😂😂
377,2018年12月22日,5,台版和日版的語音都超棒！若男主衣服會變化會更好
378,2018年12月22日,5,我不得不說真的很好玩，劇情真的很棒.讓人一直想要看下去❤已愛上瞭妹總裁了❤❤
379,2018年12月25日,5,十分好玩，但切換專家可以不要金幣嗎，初玩者沒有太多金幣。
380,2018年12月24日,5,我的布丁呢(´⊙ω⊙`) 希望可以快點修復舊的bug啊 聘請專家那個太坑了
381,2018年12月20日,5,很棒的遊戲！很喜歡男主角的聲音，還可以與他們約會，非常喜歡手機互動的部分！加油！
382,2018年12月14日,1,遊戲在外名聲太差 官方diss 玩家， 暗改抽卡概率，描圖神秘信使 。開了港台服印象也不會變。
383,2018年12月22日,5,我很久沒玩這種類型的遊戲了，突然覺得好好玩
384,2018年12月21日,3,想問問事前預約的序號要去哪裡才可以輸入
385,2018年12月18日,1,跑了半天都進不去，我同學兩次就進去了，一直跑又一直刪除下載，爛到爆
386,2018年12月20日,2,誰可以告訴我為甚麼沒辦法簽到7天登陸
387,2018年12月16日,1,下載之後進去遊戲裡的更新跑了好幾遍都還沒好
388,2018年12月16日,1,一直更新解壓更新解壓 等那麼久都還沒進去遊戲
389,2018年12月16日,3,用27000抽了10抽，抽到幾張SR可是後來看了一下羈絆卻沒有出現...
390,2018年12月15日,4,模擬器剛開就閃退QQ不知道發生什麼問題了
391,2018年12月14日,3,一直卡在解壓縮的畫面，卡了一個多小時，跑完又重跑，跑完又重跑，網路滿格，也不是網路問題
392,2018年12月13日,4,希望能盡快將每周任務、自動漫遊等更新出來
393,2018年12月15日,1,為何我儲值的那隻13等帳號會變成一開始什麼都沒有的1等？！！
394,2018年12月13日,1,明明抽出了很多張SR，卻都沒有顯示，怎麼辦啊心好痛啊啊啊
395,2018年12月13日,4,陸版的語音有點太小聲了，都會被背景音蓋掉
396,2018年12月15日,4,為什麼網路穩定更新卻要跑超久更新完就退出，又要重更新
397,2018年12月11日,4,未收到兌換簡訊是正常的嗎
398,2018年12月14日,2,我每次跑到67就停掉要重跑
399,2018年12月14日,3,請問如果一開始用遊客登入，後來用遊客登入的帳號能改綁FB嗎?
400,2018年12月29日,5,很有趣 還可以自己選要日配還是陸配等等 (´・ω・｀)真的很不錯玩
401,2018年12月29日,3,登不進去 一直更新 到了100% 又從新在跑 我很不耐煩!
402,2018年12月28日,4,想說回台服支持一下，但陸服配音真的太強大了…
403,2018年12月27日,5,超棒555 這輩子遇過最棒的遊戲ㄌ
404,2018年12月28日,4,版本更新後 變得還行 繼續加油吧
405,2018年12月28日,4,太好玩了ww白飞飞簡直夠我看一年www
406,2018年12月26日,5,好玩 但希望有更多獎勵可以拿 體力可以多一點
407,2018年12月28日,5,Bug修復速度蠻快 補償也挺有誠意
408,2018年12月29日,4,玩了陆版果断放弃台版啦!!! 陆版通关送sr李怼怼、专家招聘人数的等级限制也较台版低、聘专家不用花那该死的一堆钱…… 我觉得吧 其实就算他们做了其他版本也根本没打算让任何人离开原版 更甚者还可能吸引更多人玩陆版 一种推销方式的概念？
409,2018年12月25日,5,真好玩！跟之前的遊戲性質都不一樣，一次可以玩好久，玩得太投入了，劇情也很豐富，就是每位男生的配音太像了。
410,2018年12月26日,5,每個角色都很愛 如果體力可以賺快點就好了
411,2018年12月26日,5,故事好到爆，但希望後面不要太難，我還想繼續看內容
412,2018年12月29日,5,撩妹技巧超高，玩的心情很好。可惜偶爾或卡卡的
413,2018年12月29日,5,不錯玩的遊戲，劇情很豐富，不過體力少，等待時間長，錢幣太難賺，很難升級卡牌
414,2018年12月29日,4,是否可提供超商繳款的儲值方式，比較方便
415,2018年12月29日,5,劇情超讚，人設也都超棒！每個都好帥rrr
416,2018年12月28日,3,整體還可以輸入ID10834922交朋友!但希望更換專家可以傳承!
417,2018年12月28日,4,好有趣，但劇照時的對話框很礙眼，希望能改成能消失的
418,2018年12月28日,4,遊戲很好玩。但要是能夠開放超儲就更好了
419,2018年12月26日,4,體力消耗大 鑽石少消耗大 除了這些其他都還好
420,2018年12月28日,5,陸配的聲優太小聲了 有時BGM都會蓋過去
421,2018年12月25日,5,超好玩！超讚！可以讓我連續登入超過七天的只有它了！重拾少女心！
422,2018年12月25日,5,感覺真的有戀愛的氣息呢 就是拍攝方面有點麻煩
423,2018年12月27日,5,升級金幣消耗太多了吧…根本就升不上去啊，這麼多角色，怎麼玩？
424,2018年12月24日,5,除了聲音不好聽（不夠陸服好聽），其他還可以。
425,2018年12月22日,4,能提供更多儲值管道嗎 像奇蹟暖暖那樣><
426,2018年12月25日,3,1.進化跟升星的金幣太高了，希望能降低。2.每個關卡獲得的金幣是否能提高？3.城市漫步真的是沒必要存在的任務，浪費時間。4.一個關卡才1個好感度，玩到100個任務才有100個好感度，花那麼多時間才提升100好感度，這設定有毛病啊？ 不想聽官方設定好的回覆，請實際做出折衷辦法，不要“只是”說說，說說大家都會。
427,2018年12月25日,5,許墨說他可以給我更多所以
428,2018年12月20日,5,暖暖也是一開始就是原始版本然後再慢慢跟上，希望戀與不要像後期暖暖一樣開飛機趕進度，荷包會跟不上。 台版配音很優秀，帶入感更強，雖然中配很強大，但是有屬於自己的語言和腔調聽起來就是比較舒服，表白台版配音的四位cv，真的很棒QQ 連細節都有顧到，聽起來就很舒適！！！
429,2018年12月20日,4,我玩到一半一直說網路有問題？其他遊戲都不會
430,2018年12月20日,3,雖然，我覺得這個遊戲還滿好玩的但是，升級速度很慢而且，有點坑
431,2018年12月17日,3,我抽到了一張周的SR但他卻沒給我QQ
432,2018年12月19日,5,載了這遊戲後我痛恨發明體力制的人
433,2018年12月16日,1,一直更新解壓更新解壓 等那麼久都還沒進去遊戲
434,2018年12月15日,2,台版錢很難賺，要顧用專家錢都沒了，希望可以改善一下
435,2018年12月15日,5,很好玩~~不過希望有一個提示，因為有時會忘記要如何操作
436,2018年12月15日,4,SSR抽卡機率有點低 活動多一些鑽石多拿一些
437,2018年12月11日,5,你好 請問 序號是要在遊戲裡面哪裡輸入呢
438,2018年12月13日,4,抽卡機率感人，SR以上幾乎都是碎片～之前還以為抽到SSR了呢…(´・ω・｀)
439,2018年12月15日,5,如果這有動畫版，我一定追 太喜歡這裡面的四大帥哥了！
440,2018年12月28日,5,白起真的好帥💓可是，說實話，台版配音真的是比不上日版配音……
441,2018年12月28日,5,如果中ssr的機會高點就更好
442,2018年12月28日,5,希望漫步趕快改成自動的，實在沒時間慢慢點啊
443,2018年12月28日,3,之前說的電話沒有聲音，以及字幕重疊，修復後還是沒用
444,2018年12月27日,5,超棒555 這輩子遇過最棒的遊戲ㄌ
445,2018年12月27日,1,體力太少不夠用 強迫性課金
446,2018年12月29日,5,讓你感覺酸V酸V的戀愛腐臭味XDD
447,2018年12月29日,5,希望可以快點開放更多章節XD
448,2018年12月26日,5,好玩 每天用一點點時間去玩就可以了
449,2018年12月26日,5,白起叫我評五星所以我就來了～
450,2018年12月29日,4,會令人有少女心，但一定要跟戲本，欠缺創意
451,2018年12月29日,5,可以體力在送多一點！抽有限卡片機率能提供多一些嘛！
452,2018年12月29日,5,圖很美 我喜歡超能力這個題材
453,2018年12月28日,5,看在許教授的臉給你五顆星
454,2018年12月26日,5,好帥阿阿阿 還會祝我生日快樂真的很感人😍
455,2018年12月25日,5,請問序號要輸入在哪裡？ 問題已解決，謝謝小編回覆唷！
456,2018年12月26日,5,我一隻手給你五星，另一隻手握著白起
457,2018年12月26日,5,我被許墨誘惑來評五星了QwQ
458,2018年12月26日,5,許讓我中許墨吧，希望限時優惠可以平日也有👍
459,2018年12月26日,5,希望東西能趕快跟陸版一樣齊全
460,2018年12月25日,2,卡片也太難抽到SR了 有夠難過關卡的
461,2018年12月28日,5,不論是在劇情還是設定，各方面的細節都很好，很喜歡
462,2018年12月28日,3,抽到SR的卡之後都沒有出現！ 已經很多張了啊😭
463,2018年12月28日,5,我的ID是10846978 大家一起加好友吧
464,2018年12月24日,5,飛飛要我一隻手給5星，一隻手握緊他
465,2018年12月27日,5,畫風跟人設都屬上佳
466,2018年12月26日,5,會讓人不自覺地沉迷下去的遊戲
467,2018年12月25日,5,有用心的改了一些小細節，不過錯字麻煩要改一下
468,2018年12月23日,3,為什麼我的鑽石從16000變成1614我根本沒動他。。我傻眼
469,2018年12月20日,5,我之前也是不能下載遊戲的
470,2018年12月14日,5,台服出貨率比陸服高的多，五星還你（真香
471,2018年12月23日,4,很好玩 人物很帥劇情又飽滿 可是拜託 可不可以請在升級卡片的地方 1.弄一個「提升一等」的按鈕 不然後期升SR卡按初識心願 按到好煩...可以參考一下陸版升級頁面配置 2.雇用專家每次都要花一次錢很煩... 升級要錢我可以理解 但是雇用🤦🤷
472,2018年12月17日,5,全部細節都做得非常好 劇情也非常好 真的太棒了
473,2018年12月18日,4,超好玩，還知道我什麼時候生日，可怕，最♥李澤言跟周棋洛
474,2018年12月13日,5,雖然沒有要在台服玩，但還是喜歡你們這款遊戲
475,2018年12月12日,2,為什麼雇用人還要錢？真的很不理解，而且字體看的也很累，禮包更別說，也比較貴，什麼情況？
476,2018年12月16日,5,除了配音有點可惜外 其他都很喜歡
477,2018年12月16日,3,陸版的城市漫步明明就已經改成50步了，台版怎麼還在100步= =
478,2018年12月12日,5,請問序號要在哪輸入因為是簡訊通知的
479,2018年12月14日,5,很棒的遊戲，感覺一掉進坑就爬不出來了XD
480,2018年12月27日,5,很喜歡它的畫風，畫面的切換也不用等它跑，效率很好
481,2018年12月27日,5,超好玩但可不可以給多一點體力
482,2018年12月28日,5,玩過之後就聽不下來了，一整個超讚
483,2018年12月27日,5,故事流程真的很棒人物角色也很不錯
484,2018年12月28日,5,可以可以 雖然還是有點差異但是已經方便很多了
485,2018年12月28日,5,很有趣，不知不覺就深陷坑底了XD
486,2018年12月29日,5,希望可以快點開放更多章節XD
487,2018年12月29日,5,建議言言的聲音可以換一下 這樣就完美了
488,2018年12月26日,5,人物精美，很好玩，我第一次這麼迷這種戀愛遊戲，雖然後面很虐🤣
489,2018年12月26日,5,cv的聲音能令我一整天處於幸福到暈的狀態_(:3」∠ )_
490,2018年12月29日,5,氪與紙片人的遊戲。給總裁布丁5顆星
491,2018年12月29日,5,劇情很吸引人，少女心整個噴發，但希望換專家可以不要錢👍👍
492,2018年12月29日,3,這是一個好遊戲 但是後面好虐心
493,2018年12月29日,5,遊戲、劇情與人物都很棒，不過QAQ劇情真虐，阿阿阿！對了，這遊戲有配音w
494,2018年12月29日,1,漫步很浪費時間自動還要收費，玩不太下去。
495,2018年12月29日,4,有時有網路，但卻不能玩，請修正，可是很好玩滿推薦的
496,2018年12月28日,5,劇情不錯 每個人物都很有特色
497,2018年12月25日,5,如果能不一直卡關會更好
498,2018年12月25日,5,這是我目前玩這類遊戲最好的
499,2018年12月25日,5,喜歡周棋洛這顆暖暖的小太陽
500,2018年12月25日,5,還不錯，不過我太非真的抽不到SSR
501,2018年12月25日,5,希望可以增加體力及拍攝副本回覆倒數
502,2018年12月25日,5,遊戲劇情後期很虐心，但會支持玩下去
503,2018年12月26日,5,是個很不錯的遊戲，只是如果沒有mvp，馬拉松太難完成了
504,2018年12月28日,4,希望多點據情多一點和活動和免費寶石活動多一點
505,2018年12月25日,5,被撩的很愉悅，只可惜日文語言只有劇情才有……QAQ
506,2018年12月25日,5,抽獎沒多久就抽到SSR的超開心
507,2018年12月24日,5,太甜蜜了…唯一缺點口袋要很足
508,2018年12月24日,1,根本沒辦法登入 登入成功又自己登出
509,2018年12月26日,4,劇情看一半畫面卡住，需要整個遊戲重開
510,2018年12月25日,5,這不是普通的戀愛遊戲呀rrr 沉溺其中無法自拔嗚嗚嗚…
511,2018年12月22日,5,感謝台服的代理 希望能越做越好
512,2018年12月25日,5,最愛鋼鐵直男白飛飛白起
513,2018年12月23日,4,很想知道結局 可是結局不會不好吧
514,2018年12月18日,5,李太太到此一遊❤ 雖然最雷的是我李的配音😢
515,2018年12月17日,5,我希望卡片可以出更多，因為台版沒有陸版的多。
516,2018年12月15日,3,用臉書登入一直進不了 只好一直更新
517,2018年12月15日,5,很喜歡這遊戲！所以很希望能使用點數卡儲值！
518,2018年12月15日,5,想請問有無和點數卡合作? 不想用信用卡跟電信帳單~
519,2018年12月16日,5,為什麼它叫我按動態，但按進去就當掉了
520,2018年12月27日,5,很好玩，四個男主都有自己獨特的性格，每個都好喜歡哦！！
521,2018年12月29日,5,希望限定抽卡率能高一點
522,2018年12月28日,5,一款讓耳朵懷孕和荷包失身的遊戲
523,2018年12月27日,5,為了李澤言給五星 後期劇情是真的胃疼。
524,2018年12月26日,5,好多帅哥 流血了 不會常常bug 好玩
525,2018年12月29日,5,很好玩～ 讓人怦然心動💗 主角們都超帥
526,2018年12月27日,5,這幾天會莫名無法載入，只能刪掉重安裝..
527,2018年12月26日,5,多元化 蠻有趣的有時候給的優惠也不錯
528,2018年12月26日,5,彷彿身歷其境，不知不覺都戀愛了♥ 操作模式宛如就和男主角真實的互動 很多種遊玩破解任務方式，多元不無趣😊 我是看“YouTuber魚乾”介紹這款遊戲， 一開始只是下載來遊玩看看， 想不到已經完全陷入進去，真的很好玩， 有時太入戲，都忘記我是在玩遊戲呢😳😳 很棒的遊戲，推薦給各個年齡層的女孩們♥
529,2018年12月29日,5,人物很帥，不錯…不過，抽蛋的時侯也太難中了吧
530,2018年12月29日,3,體力回得稍慢，sr不太好獲得，專家太花錢
531,2018年12月29日,5,遊戲、劇情與人物都很棒，不過QAQ劇情真虐，阿阿阿！對了，這遊戲有配音w
532,2018年12月29日,5,好帥 我要握緊你的手
533,2018年12月28日,4,聘請專家可不可以改成免錢？陸版的都是免錢
534,2018年12月28日,5,畫風很美，有讓人想玩下去的動力
535,2018年12月26日,5,畫風很夢幻 主角也很帥 很棒的遊戲
536,2018年12月26日,5,蠻好的 就是希望鑽給多一點
537,2018年12月25日,5,讓我單抽獲得SSR必須讚
538,2018年12月26日,5,超棒的遊戲 快來一起玩 哈哈
539,2018年12月25日,5,許墨叫我來給5星
540,2018年12月26日,5,希望體力跟羈絆的升級道具能給多一點😂
541,2018年12月28日,5,白太太表示一隻手給五星，一隻手握緊你了
542,2018年12月25日,5,很好玩跟別款遊戲不一樣
543,2018年12月25日,5,遊戲超帥氣的 玩德小鹿亂撞
544,2018年12月25日,5,近期最讚的遊戲 我是許太
545,2018年12月25日,5,劇情有糖有刀子，懸疑又奇幻，重點是白起超級帥氣、超級可愛♡
546,2018年12月25日,5,為了四位老公只能通通五星
547,2018年12月21日,3,希望可以有跳過新手教學的按鍵😂😂老玩家一直卡教學，前期玩得很心累😂😂
548,2018年12月20日,3,之前明明可以進入，現在卻不行，等得耐心都沒有了
549,2018年12月19日,5,希望可以增加其他課金管道，現有的對學生黨都很不友善QuQ 然後慢步無課真的不能自動嗎？！我也很想肝完1200啊 可是你們知道全程手動要花多少時間嗎QQ 心好累... 另外希望增加收取好友體力的上限，以及一鍵發送所有好友體力的功能，登入沒幾天好友信箱就爆了
550,2018年12月21日,5,語音超讚的，體力每5分鐘一點顆心太慢了Q∆Q
551,2018年12月20日,5,希望能快點跟上陸版
552,2018年12月16日,2,為什麼進不到遊戲介面一直在更新
553,2018年12月15日,4,希望能早點跟上陸版的優化
554,2018年12月12日,3,希望陸配可以有更多章節
555,2018年12月14日,5,之前看到戀與在陸版很紅~~玩了台版真的很喜歡~~❤️ 歡迎加好友~10052276
556,2018年12月13日,5,很喜歡這款遊戲， 希望可以盡快優化成陸版的進度， 台版跟陸版都有玩! 加油！
557,2018年12月18日,5,不知道為什麼我的SR周期洛不見了
558,2018年12月12日,4,不太喜歡現在的配音，李總的聲音有點崩
559,2018年12月12日,3,陸服有些地方已更新，漫步怎麼還是最初陸服開啟的樣子?
560,2018年12月29日,5,希望限定抽卡率能高一點
561,2018年12月27日,5,還不錯啦 衝著白起給五星哈哈哈
562,2018年12月27日,5,是台陸雙修的太太 覺得經營的很用心!
563,2018年12月27日,5,真的很好玩ಥ_ಥ 最喜歡白起了ಥ_ಥ
564,2018年12月28日,5,每個男主都好帥帥ㄛ
565,2018年12月27日,5,要過關卡都好難啊！ 不過劇情真的很好看!
566,2018年12月27日,5,聲音效果和人物設定都非常好
567,2018年12月28日,5,最喜歡許墨跟白起！！！（比心）非常謝謝台版終於出了
568,2018年12月27日,5,很棒的遊戲，希望能夠趕快跟陸版的一樣
569,2018年12月27日,5,天呀，白起超帥ㄉ，遊戲背景好看音樂好聽，都沒什麼問題
570,2018年12月26日,5,如果儲值方式再多一些(如mycard之類的) 會更好
571,2018年12月26日,2,還不錯玩，但是一直要花錢過關很不愛
572,2018年12月25日,5,還不錯玩，但專家那個要一直花錢換，不太理想
573,2018年12月29日,5,遊戲性一般，人物劇情不錯，用力肝也可以很強
574,2018年12月29日,5,超棒的！還可以改暱稱！我把白起的暱稱改成了老公！白起～～我的至愛
575,2018年12月25日,5,我可以來換布丁嗎😂，希望城市漫步系統早點自動化，謝謝/
576,2018年12月25日,5,好玩，又特別的遊戲！只是SR和SSR真難抽
577,2018年12月25日,5,很給力的遊戲！非常大方，增加了遊戲性，給妳們加油鼓勵
578,2018年12月28日,5,男主們都太帥啦
579,2018年12月25日,5,非常的好玩，但錢很難賺而且升級卡牌要花很多錢。
580,2018年12月24日,5,很好玩 劇情設計的很棒 讓人意猶未盡
581,2018年12月24日,5,希望可以快快變成免金幣更換專家，加油
582,2018年12月27日,5,阿阿阿 每個人都好帥♥♥~~ 不要只能用信用卡嗎@@ 這樣不好課（哭哭
583,2018年12月27日,5,白起要我留言鼓勵我就來了
584,2018年12月25日,4,無課離srssr都太遠拉
