,Date,Score,reviews
0,2018年12月12日,5,會突然跳出去其餘的都還不錯 劇情一跳出去重登要從頭開始看 希望可以改進
1,2018年12月19日,5,您好，買了特權補給，信用卡刷卡成功，但是購買的體力等數值卻沒有提升？已按修復更新了一遍依舊如此，能否幫我處理呢？謝謝您。
2,2018年12月19日,5,希望過年前出點數卡，點數卡真的比較方便啊🙄🙄🙄電信帳單，學生黨都會被家長發現又要被訓，真的很需要點數卡🙇🙇🙇
3,2018年12月23日,3,任務給的錢太少，升級花的錢太多，整個遊戲生態就是一個不平衡。這樣的遊戲無法讓人想長久玩下去。
4,2018年12月11日,5,起子我來了！白夫人報到！終於上架了啊啊啊啊QUQ這次應該方便課了XD
5,2018年12月12日,4,在解壓縮的時候卡住，重開機後就直接卡在最一開始疊紙logo那邊了qwq
6,2018年12月18日,5,不知道會不會像暖暖一樣推出辣椒卡或mycard儲值管道，希望能早日氪金
7,2018年12月13日,5,下面蘋果布朗尼第一次玩台灣代理的別國遊戲？ 大部分代理遊戲都是從最初開始一步一步跟上進度，懂？
8,2018年12月11日,4,我們的名字比較生癖的字會顯示不出來…希望可以改善(簡中版可以顯示）
9,2018年12月13日,5,台版很用心，可以綁定臉書登入超方便，唯一美中不足的是……字體太細看的很吃力，可以改看起來舒服的字體嗎？
10,2018年12月11日,5,陸版的語音感覺比台版小聲欸 都被BGM蓋掉了（只聽了1-4
11,2018年12月17日,3,我真的很想儲值，可是我只有18歲沒辦法課QQ拜託弄出辣椒卡給我們課好嗎？
12,2018年12月12日,4,台版許墨聲音好評！不過我愛杉田智和嘿嘿嘿
13,2018年12月11日,5,愛人生！終於在Google play上架了！到時候再補評論，許墨我來了！
14,2018年12月25日,5,一堆雞雞歪歪的說陸版好回去玩阿 也不看看多亂多複雜一堆東西 為了搶先玩去下載陸版 現在台版開始就在吵 怎不乾脆吵說把陸版帳號整個搬到台版的
15,2018年12月26日,5,這個手遊真棒 真的能夠感覺到有男友的樣子 但我還是希望可以由女主自己打給他們 或者是可以讓他們多打些電話給我們
16,2018年12月25日,5,故事性很好，需要花點時間，但沒關係 有關係的是要你花錢儲值的套路 有點玩不下去
17,2018年12月24日,5,背景樂好聽但太大聲了，很容易壓過語音，希望可以有調整音量大小的設定
18,2018年12月23日,1,好氣喔 早上起床城市漫步就歸零了wtf 100才能加100好感度還歸零就不用玩啦 還有卡都抽到許墨還有周棋洛 啊我就喜歡白起還有李澤言啊 很氣ㄟ
19,2018年12月27日,5,想詢問事前登入的獎勵序號要輸在遊戲哪裡QQ
20,2018年12月11日,4,起了個大早發現自己居然還排這麼後面哈哈?!! 等中午來更改星星~
21,2018年12月28日,4,聲優畫風超棒的 可惜還是有Bug 明明什麼情況都沒有就冒出驚嘆號讓你點，點完還不知道發生什麼事
22,2018年12月28日,5,一款很令人心動的遊戲 遊戲劇情和關卡都很吸引人 會有很想征服這些關卡的衝動 是個讓我大推的戀愛手遊
23,2018年12月25日,5,很有質感 而且男主真的都很帥 劇情也有一種會讓人想玩下去的感覺 最喜歡許墨跟白起❤
24,2018年12月25日,4,這次更新後一次抽多張卡 就不能回覆前面卡片的動態 因為更新前不會有這樣的狀況 想請問這部分可以改善嗎？
25,2018年12月26日,5,遊戲的背景音樂希望可以自己調整大小 感覺背景音樂太大聲了，我想聽對話的聲音R 可是把聲音弄大，音樂就會一起變大很困擾 完全把音樂關掉又很怪
26,2018年12月14日,3,不知道為什麼 明明進度條已經跑到100%了 但是進度條又立刻歸零 之後就沒有反應了 是我手機的問題嗎
27,2018年12月21日,3,很氣哦 連官方給的10抽 一張SR都沒有 機率到底是有多低？ ಠ_ಠ 我等級都快30了 傻眼
28,2018年12月18日,3,"我覺得遊戲很好玩也製作的很棒,但我每次要進入遊戲頁面都卡住進不去,一定要解除安裝重裝才可以,希望可以改善這一點噢"
29,2018年12月22日,4,希望能增加購買卡點的儲值渠道，因為對學生黨來說電信付費和信用卡都不是很方便
30,2018年12月15日,4,已經發生兩次遊戲打不開的狀況了，點選遊戲主頁的修復選項也沒有用，一定要整個遊戲刪除重載才能玩，開其他遊戲都沒有這個問題
31,2018年12月25日,5,吹爆文案！ 這是真的不是戀愛遊戲！ 是個很有深度的一部作品 龐大的世界觀+劇情 歡迎一起來戀語市談個假的戀愛😂
32,2018年12月28日,4,這遊戲是不是會讀心術阿QAQ 一直想抽到李總抽不到 不想抽到的周狂抽 要怎麼賠償我心裡創傷😢
33,2018年12月28日,5,因為要讓人課金意圖挺明顯的所以乾脆玩的很休閒，偶爾買買30塊禮包是極限，反正關卡推不了就放著，慢慢升級卡片再去推
34,2018年12月12日,4,要最後就過不了了 原本想繼續玩的 好希望玩完 希望能給個答案
35,2018年12月19日,5,遊戲很好玩，但是為什麼我用電腦下載了後，它顯示已下載卻都無法在電腦裡找到?
36,2018年12月22日,5,"前面的問題已經修正,原本就非常喜歡這款遊戲!和四個野男人談戀愛的感覺真的開心哈哈哈wwwww"
37,2018年12月15日,3,體驗感不佳。沒有福利活動，如果想推進度的話必須要先課金，比起陸版來說優化和福利都是需要改善的
38,2018年12月19日,5,請問可以將背景音樂改小聲一點點嗎？想打開但又會蓋過人聲，關起來又覺得太安靜了！無法一邊聽好聽的音樂一邊走遊戲
39,2018年12月26日,5,從陸版玩來台版！ 不過希望鑽石跟券券可以大方一點送（咳# 希望活動卡如果住在卡池可以好撈一點 希望趕快出自動送愛心給好友的功能❤
40,2018年12月26日,5,我在中服一個李太太，回來台服活生生變成一個白太太，請問什麼時候導入一鍵升級啊？小紙鶴根本餵不飽一張SSR啊
41,2018年12月18日,5,原本對戀愛遊戲嗤之以鼻，看到別人說是中配想說來看看，玩了覺得意外的超級吸引人。不過中配語調上還是比較平呢
42,2018年12月22日,4,很好玩 玩過陸服 但是我今天下午嘗試了很多次都進不了遊戲 一直都是疊紙和joybomb logo的畫面 之前也已經試過一次 那時我唯有刪除了再下載 很麻煩...
43,2018年12月28日,5,劇情好看 人物唯美 整體感覺太棒了 再加上背景音樂整個很讚 還有配音的也很棒 非常喜歡😍
44,2018年12月27日,4,希望可以有解除綁定的功能，因為像我在登入時不小心按到以電子信箱登陸，我原本的帳號就無法綁定電子信箱了
45,2018年12月18日,4,我覺得整體很不錯，但為什麼總裁的困擾和白起的攝影棚風波的電話沒有語音阿阿阿啊，我花那麼多時間升級結果沒語音我整個人腳軟傻了啊，希望能幫我處理一下語音的問題，辛苦你們，拜託了QQ
46,2018年12月28日,5,好玩 男生都很帥 然後希望福利多一點 還有除了遊戲儲值之外也希望有其他的方式可以儲值
47,2018年12月26日,5,好玩，但不知道虛寶能不能直接在遊戲app中兌換這樣比較方便，而且找不到兌換的網址可以進行兌換😐有些序號是有時間限制的，能不能告訴我哪邊才能成功兌換我的序號啊？
48,2018年12月26日,5,玩過陸服，知道以後各項功能都會優化得很好，台服團隊續加油喔~ 還有台服許墨的配音好溫柔又多了許多人情味，實在太喜歡了哈哈哈
49,2018年12月11日,5,嗯...雖然還是比較習慣陸版的配音員 不過台版的配音員其實也很好聽😙
50,2018年12月14日,3,你好！ 我今天在登入遊戲時不小心按到登出，之後我想再重新登入時確一直顯示錯誤，我是用FB綁定的，按修復也無法重新登入，重新卸載再下載也不能登入，請盡快解決
51,2018年12月14日,5,歡迎加油 🆔️:10908571 超級好玩 因為是同公司所以和奇跡暖暖有點類似😂😂 玩奇跡暖暖2年多了 相信這個也能讓我玩很久都不膩❤
52,2018年12月29日,5,雖然台版的版本很舊 可是活動＆獎勵很多!! 但是有時候背景音樂比配音還要大聲我覺得需要檢討一下🤔
53,2018年12月23日,5,劇情畫風都很棒，但是不課金很難玩的下去。另外建議背景音樂可以調整音量，劇情裡的主角配音常常被音樂壓過去，說話聽起來斷斷續續的很可惜。
54,2018年12月26日,5,遊戲真的很棒，但希望能有其他儲值管道，父母要是發現帳單上多出的金額是拿來儲值遊戲，肯定會禁止我們玩的，希望日後會有其他儲值方式，謝謝
55,2018年12月17日,5,遊戲整體都相當的好，只是不太喜歡禮包一直丟出來，好的遊戲的確需要花錢支持，但總有被逼著買禮包的感覺，但目前會繼續支持 。加油 目前也是課金一員
56,2018年12月25日,3,城市漫步不花錢的話一個要解1個多小時，超浪費時間獎勵也不是到很吸引人。且最新系統常常出現Bug，暈。
57,2018年12月25日,5,有時在遊戲過程中會當當的 希望能有多次某個卡或角色得到率升高這種活動 不然一直重複拿到一樣的卡....
58,2018年12月29日,4,現在玩是還沒有用到儲值，但改主角名字要購買改名卡，就有點兒坑人了，改名字不是遊戲本身就免費的項目嗎？還不錯玩
59,2018年12月26日,3,遊戲本身很喜歡，整體感覺都不錯，唯一缺點就是太花錢啦…基本什麼都需要花錢買，沒有花錢買遊戲就很難繼續下去，東西又不便宜…久了這個遊戲根本就玩不下去啦
60,2018年12月25日,4,故事內容及氣氛營造很棒 但是實在太容易卡關了 小課一點也玩得很辛苦
61,2018年12月12日,5,一年前我不該介入戀語市的紛爭，現在我又來了(真是又愛又恨
62,2018年12月20日,3,體力用買的越買越貴，為什麼不能統一20鑽就好，每天都只能玩一點點…50鑽60體力花不下去
63,2018年12月23日,4,買了VIP但是卻沒有得到上面所謂的立刻加值300顆鑽石耶！可以用我處理一下嗎？謝謝
64,2018年12月28日,5,非常的好玩，等了這麼久終於值得，雖然有時虐心有時很甜，不過一進入那樣的劇情就已經無可自拔的喜歡上了
65,2018年12月22日,5,超級好玩的，現在每天早上上學前都有動力爬起來了！劇情發展總會讓人一直想看下去！只不過陸版的東西更多，希望到時台版也能跟上腳步～
66,2018年12月25日,5,希望可以有一鍵贈送愛心的鍵 白起好帥 李擇言霸氣 許墨聲音好好聽啊啊啊啊啊
67,2018年12月25日,5,整個遊戲的流暢度都很棒 尤其是要進入下一個章節前女主的夢 畫風優美 聲優的聲音滿好聽的 只是有時有背景音樂會蓋過聲優 在麻煩開發人員去調整了 很值得玩的遊戲！！
68,2018年12月28日,5,很好玩，可以切換台陸日三種語音真的好棒哦。 只不過金幣花得有點兇，一下子五百七百的花就破產了XDD 很棒的遊戲，請繼續加油！
69,2018年12月26日,3,希望好友信件不要限制收取量1天只能收20保留只能3天但好友可以加到99完全比例不符……
70,2018年12月11日,5,許太太到此一遊❤撩撩等我，我來了！ 懟懟、飛飛、洛洛也進到我的懷抱裡來吧💕
71,2018年12月11日,3,消費價格比陸服貴一些，專家的切換每次都要費用，感覺很怪
72,2018年12月12日,5,啊配音聲音就可以調啊是在抱怨什麼還你原配還很兇喔
73,2018年12月16日,5,非常棒 不過好像有個bug 就是與白起的訊息 警察制服的那一個對話他最後一句話說“已經不早了，女孩子不要睡太晚，晚安。”是不要太晚睡對不對w
74,2018年12月29日,5,很喜歡各種角色人物，充滿很多刺激的故事內容，希望能不要用到錢的步分，更加希望可以開放 遊戲外的儲值，對學生或一些不好直接用手機儲值的人比較方便。
75,2018年12月24日,5,遊戲卡住 城市新聞這個部份 在還沒有城市新聞這個介紹的時候之前就把卡牌放上去了，結果遊戲跳出，城市新聞就完全不能動
76,2018年12月21日,5,信箱那邊可以不要有領取上限嗎？體力看得到卻領不到，真煩啊
77,2018年12月26日,3,請問為什麼不能用信用卡以外的方式儲值啊，不是每個人都有信用卡，直接開放辣椒卡輸序號不是很好嗎？等官方處理，我想儲值都不行。
78,2018年12月25日,5,遊戲比我想像的還要流暢 劇情也很棒 但活動或語音方面好像有點少
79,2018年12月26日,4,希望更換專家不用付錢，背景音樂小聲點。我現在玩到了第5章，好想知道之後的劇情，還有那該死的背景音樂搞得我快抑鬱了。
80,2018年12月14日,5,可以下載，整個安裝到一半就不能登入了，怎麼重載都沒有用一直登不僅台版，陸版沒問題，台版剛開我現在還是進不去😂
81,2018年12月19日,4,遊戲是很不錯，但體力恢復太慢，而且城市新聞那個，點擊很快了還是破不了覺得很煩，希望這個可以改掉，不然缺少那些腳色在打關卡的時候會找不到適合用的腳色。
82,2018年12月24日,5,希望能有更多元的儲值方式 比如說mycard帳號或點卡之類的，可以改成和暖暖一樣出個mycard版本~
83,2018年12月27日,3,希望好友送體力讀取信箱不要只限制20個，這樣太少了！還有城市漫步功能實在太廢了，好浪費時間。
84,2018年12月26日,5,角色塑造很棒，CG也都好美呀！ 活動也很大方，送體 送金幣 道具 跟SR，還是最喜歡的白起～ 希望能增加好友一鍵送體，不然一個個按好麻煩
85,2018年12月23日,5,很好玩 希望能有調整bgm音量大小的功能 這樣才不會聽不清楚配音員的聲音
86,2018年12月28日,4,好友最多可以增加到99名，但是領取好友贈送的體力卻只能到20次，這方面能否調整一下，要不有的3天期限一到，沒領取的體力就自動刪除掉，那好友門檻還需要設定到99名嗎？
87,2018年12月26日,5,我第一次玩這個時，原本是要用來打發時間，沒想到玩到最後我竟然迷上了這個遊戲，他是我玩過最好玩的遊戲了。
88,2018年12月25日,5,質量很高 但性子急又不想課金的不建議玩
89,2018年12月28日,4,那個好友系統可以改成刪好友後不會一直重第一個慢慢滑下來嗎
90,2018年12月25日,4,還是喜歡陸版許撩撩的聲音，整體比較像還沒優化初期的戀與製作，還可以，就是抽卡率還是太低了………bgm無法調整聲音大小，有時候聽不清配音的聲音
91,2018年12月26日,5,陸版玩很久了，台版準備固定課金。 希望角色/玩家名字可以改回特明體比較好看Orz
92,2018年12月29日,5,"這個遊戲的劇情設計真的有種讓人想一直看下去的fu, 重點是卡片各個都好好看而且也很多，讓我想一直收集直到整個都到齊才行！！會一直支持這款遊戲的！！！加油！"
93,2018年12月27日,5,哎呀呀～不推不行啊～台版配音也是各種帥，尤其是周棋洛詮釋得好可愛說🎶🎶，話說某些因為先追過陸版，所以聽慣陸版配音，也才因而導致自身對於其他配音版本，產生了那一時的不適感的人，就麻煩去試著「虛心」且「不帶負面成見」的好好適應並欣賞它，而不是只會在那把「自身的適應力問題」，「轉嫁」到他人的表現好壞或存在價值上的只是以偏概全的用自己的喜好來自私且不客觀的徹底否定他人的努力與價值，再說如果真無法或根本是懶的去適應的話，那就請自行切換其他版的配音，人家可不是沒給你們選擇。(-.-)
94,2018年12月13日,4,整體而言還不錯，而且活動滿多的，一下子就投入遊戲中♥ 如果能夠增加基本的體力就太棒了，不然為了升星一下子就用光了，另外專家的升級費越來越貴了，希望能夠降低點，到了後期錢都不夠 另外希望能增加回收卡片的功能及卡片轉移功能
95,2018年12月13日,4,剛開始沒有綁定，但後來在點進去頁面的時侯，以為點FB登入可以變成綁定，發現要從頭開始，回到原本沒綁定的，想再綁定就沒辦法了
96,2018年12月16日,3,整體來講還不錯，但是我事前預約序號怎麼輸入都顯示錯誤，寫信到客服也都完全沒有下文，到底是要不要我繼續玩下去？給點回覆好嗎？
97,2018年12月19日,2,不斷得跑更新跟解壓縮有點讓人傻眼，是看身邊朋友說不錯才來的，到現在有點小失望。
98,2018年12月25日,4,還不錯，但和樓下的一樣，覺得雖然背景音樂很好聽，但偶爾會蓋過聲優的聲音這點不太好。還有拍攝那，要往回滑時有點卡，有時候會滑不回去。
99,2018年12月25日,5,不能在公共場所玩，會像白痴一樣一直在那邊傻笑，我不會說那是我xD 超愛白起的，整個被撩的不要不要的（羞）
100,2018年12月28日,5,抽獎機率因為新資料片還沒上導致整個停在0.25%左右抽到 會讓非洲很難過啊啊
101,2018年12月27日,3,鑽石能獲得到的數量少 但要抽10抽卡片卻要1800需要的有一點多，希望能在給等多鑽石
102,2018年12月23日,3,卡關卡太久，劇情線銜接不上，所有的熱情都被澆熄，電話的對話選擇也是很不自由，幾乎都是女主自我意志較多，導致無法融入劇情。
103,2018年12月28日,5,目前整體遊玩感受還是不錯的，希望城市漫步自動的速度能再快一點或是有所優化。
104,2018年12月26日,5,遊戲羈絆升級怎麼不能連點了啦，我就是期待那連點升級的快感阿，可以恢復回來嗎？而且改版後整個螢幕顯得擁擠，可以歸類一下嗎？
105,2018年12月11日,4,配音太小聲 背景音又太大聲 希望可以調整
106,2018年12月13日,3,要刷到2-9才能開局首十抽，還只有一天半的時間可以拼機率爆低的SSR 不管是原公司還是代理的做法，摳成這樣真的讓人支持不起來ˊ_>ˋ
107,2018年12月13日,4,陸服玩家在此，原以為會一樣，但沒想像中的那麼好 語音部分我個人認為陸版的比較好聽耶 不過可以再努力，很感謝出台版了，等很久💓 永遠愛澤言❤
108,2018年12月25日,4,很不錯的遊戲！角色個性鮮明且吸引人。 不過希望城市漫步的自動功能可以免費…否則跑到眼睛快壞了😂跪求優化～～感恩
109,2018年12月29日,4,一直無法打開 老是顯示屢次停止 就算重新下載也沒有改善 希望可以得到解答
110,2018年12月27日,5,每個帥哥都好帥啊 可是拍攝的部份對我有點難 希望可以在簡單一點
111,2018年12月26日,5,不大喜歡漫步系統，因為就算花錢買月卡，也是很浪費電，很傷手機，不是說要節能愛地球嗎？這樣真的要用愛發電了啦，哭哭餒
112,2018年12月28日,4,sr跟ssr有夠難抽還會抽到重複的...雖然抽卡很讓人吐血但音樂很棒劇情引人入勝，拜託調高一下ssr的機率啦抽了30幾次了沒半張...
113,2018年12月29日,3,劇情寫的很好，但不抽卡就會各種卡關根本無緣看後面劇情。限定卡機率只是騙抽的幌子，不會再儲值。
114,2018年12月22日,2,一直當機一直當機，城市漫步根本無法動彈，修復了以後還是完全沒反應！bug那麼多為什麼不快點處理
115,2018年12月25日,2,劇情比較像看漫畫，遊戲不重要本身無聊，不知道要幹嘛一直看劇情不能跳過。很單機單人遊戲比較像在看漫畫。人物好看
116,2018年12月25日,5,這是我個人認為畫風最美的一款戀愛遊戲，故事也棒！真的讓我心甘情願地掏錢啊…
117,2018年12月16日,5,改評價了，但還是希望台版官方能在網站上放載點，以防也是有人下載不到的情況。 在陸版玩過，是真的很喜歡這款遊戲，才會想支持台版。 願能改進。
118,2018年12月27日,5,從現在起 我是白起的女朋友 Boos的情婦 許墨的老婆 薯片弟的曖昧對象
119,2018年12月28日,5,一開始玩的時侯感覺沒甚麼，但越玩越感到四位男神帥的不得了。遊戲劇情豐富，畫風也很美。
120,2018年12月27日,5,非常棒，很用心，抽卡概率已經比陸版高真的，客服也很迅速。遊戲營運和代理都不易，花錢支持有什麼不好嗎？一直唉唉叫不想花錢喊砍遊戲的慢走不送
121,2018年12月17日,3,請問我的網路狀態良好，可是卻在更新畫面30幾分鐘，無法進入，請問這是我們自己的問題，還是你們那邊的問題呢？我的容量也足夠啊？
122,2018年12月29日,5,這個遊戲太好玩了 角色也都很好 只是拍片的那個評論可以不要那麼糟糕嗎？
123,2018年12月19日,5,不得不說真的很容易中毒啊 圖美劇情特別 很棒 然後好友送愛心這點希望有功能是一鍵送愛心 不然就是收愛心的時候順便一起送 不然一個一個點這樣誰還會想送愛心呢 還有劇情裡有一些美圖希望可以開放無字框的圖鑑讓太太們收藏心動的瞬間
124,2018年12月27日,1,"安裝後開啟app,出現更新畫面，進度條到100%後又跳到0，重跑7.8次100還再跑進度條，請問到底是什麼問題?真的很想玩，請幫忙處理"
125,2018年12月28日,5,超棒的！主角好看，遊戲好玩 語音也很棒，不像一些遊戲語音只有一點點 它是全部都有，真的很棒👍 很愛這個遊戲♥ 值得玩
126,2018年12月25日,5,畫風很好，主角很帥氣，劇情後來越來越虐人了😭 我建議下載，不過城市漫步真的要很長時間才能完成
127,2018年12月12日,5,比想像中好玩！畫風也很細緻！只是城市漫步可以加速嗎？雖然能自動還是希望能跑快一點~
128,2018年12月26日,4,金幣一次都給的很少但做什麼都要花錢……希望打關卡或每日能多給一點
129,2018年12月28日,5,雖然台灣配音技術比不上別的，但是聲音好好聽 角色的個性也很鮮明 喜歡
130,2018年12月28日,5,劇情很是吸引人，但希望換專家不要花金幣，不然實在都沒錢升卡片了。。。 裡面的角色每個都有自己的特點，都讓人愛死了❤
131,2018年12月26日,5,遊戲玩法有許多新意，蠻耐玩的 對話也很自然，不太會覺得不真實 配音也很棒，不會不自然 希望你們繼續加油
132,2018年12月13日,4,很喜歡~ 但是剛剛購買VIP成長特權禮包已扣款但未收到禮包的物品……
133,2018年12月24日,5,終於出了我在這裡等了好久哦，李澤言和白起超帥的啦
134,2018年12月15日,5,為什麼我沒辦法解壓縮 到了94%都會跳回原本下載的地方重下載檔案...
135,2018年12月12日,1,還沒玩到就一直卡在解壓縮77.07。一直重複，解壓縮是要解幾次啦。而且只是來評論，再回去的時候又要重新等更新，是怎樣?
136,2018年12月20日,2,畫風很美，聲音很吸引人 但是實際玩了之後！ 沒有看到菁英關卡的轉換鈕！ 也不能讓羈絆合成或進化阿！！ 那合成跟進化是講好玩的嗎！？ 能盡快改善這個問題嗎？
137,2018年12月26日,3,遊戲本身沒什麼問題， 本來就是國外的遊戲， 劇情上面都弄得不錯。 但是台灣官方送東西送的很不大方 信箱每天只能收20封這個設定也很奇怪 那我加這麼多好友的意義在哪裡。
138,2018年12月27日,2,比奇跡涼涼還涼，遊戲整體來說偏苛刻型。好友可以加至99人，但卻限制一天只能收20顆愛心，不知用意何在？ P.S.最近的漫步活動太誇張了= =
139,2018年12月23日,5,當初玩陸服不也是這樣玩嗎？ 這樣讓剛接觸遊戲的搶先體驗優化， 對玩陸服的超級不公平欸（ 那些留言真的……唉…… 繼續支持台服owo（
140,2018年12月27日,5,很喜歡這個遊戲，只是過關要的專家比較難得到，對剛開始玩的人來說啦，其他都很不錯喔~
141,2018年12月28日,5,要是城市漫步能免錢自動就好了 不然對學生來說不是很有善😔
142,2018年12月26日,5,畫風跟劇情都很棒，雖然吃錢了點但也還在能接受的範圍，畢竟代理遊戲也要錢的，感謝官方～
143,2018年12月29日,3,有的時候打不開，像我現在就一直打不開，老是這樣真的很煩，我喜歡這款遊戲，但是常常這樣真的受不了
144,2018年12月26日,5,整體都很好 不過可以不要限制接受好友的愛心嗎？一天20有點太少了而且兩天就不能用了
145,2018年12月14日,5,我是因為陸版給五星，昨天晚上下載台版，結果一直在跑剛進遊戲的更新，重跑了3.4次，而且都跑很久，解壓到一半又重新載入，今天早上也跑了3.4次進不去，快沒耐心了！！
146,2018年12月16日,4,嗯...是很好玩但是還是比較希望劇情居多，想看劇情，會因為角色不夠高沒辦法繼續，能升級的都升級了，但是還是沒辦法過關...，還是希望能以劇情為主😭不然看不到劇情真的會很難過
147,2018年12月17日,5,遊戲好玩，剛開服很多贈禮很大方，遇到問題寫信給客服回覆也非常迅速，整體都很滿意。
